"No.","Time","Source","Destination","Protocol","Length","Info"
"50","3.984568","222.29.98.58","10.1.246.45","TCP","74","5201  >  51018 [SYN, ACK] Seq=0 Ack=1 Win=28960 Len=0 MSS=1386 SACK_PERM=1 TSval=1915938303 TSecr=1455333552 WS=128"
"53","3.989120","222.29.98.58","10.1.246.45","TCP","66","5201  >  51018 [ACK] Seq=1 Ack=38 Win=29056 Len=0 TSval=1915938307 TSecr=1455333572"
"54","3.989162","222.29.98.58","10.1.246.45","TCP","67","5201  >  51018 [PSH, ACK] Seq=1 Ack=38 Win=29056 Len=1 TSval=1915938307 TSecr=1455333572"
"58","4.038484","222.29.98.58","10.1.246.45","TCP","66","5201  >  51018 [ACK] Seq=2 Ack=42 Win=29056 Len=0 TSval=1915938355 TSecr=1455333577"
"60","4.040124","222.29.98.58","10.1.246.45","TCP","66","5201  >  51018 [ACK] Seq=2 Ack=99 Win=29056 Len=0 TSval=1915938360 TSecr=1455333626"
"61","4.040162","222.29.98.58","10.1.246.45","TCP","67","5201  >  51018 [PSH, ACK] Seq=2 Ack=99 Win=29056 Len=1 TSval=1915938361 TSecr=1455333626"
"63","4.044671","222.29.98.58","10.1.246.45","TCP","74","5201  >  51020 [SYN, ACK] Seq=0 Ack=1 Win=28960 Len=0 MSS=1386 SACK_PERM=1 TSval=1915938362 TSecr=1455333628 WS=128"
"66","4.050000","222.29.98.58","10.1.246.45","TCP","66","5201  >  51020 [ACK] Seq=1 Ack=38 Win=29056 Len=0 TSval=1915938370 TSecr=1455333632"
"68","4.089476","222.29.98.58","10.1.246.45","TCP","68","5201  >  51018 [PSH, ACK] Seq=3 Ack=99 Win=29056 Len=2 TSval=1915938405 TSecr=1455333670"
"80","4.093091","222.29.98.58","10.1.246.45","TCP","66","5201  >  51020 [ACK] Seq=1 Ack=6908 Win=42752 Len=0 TSval=1915938412 TSecr=1455333677"
"87","4.093139","222.29.98.58","10.1.246.45","TCP","66","5201  >  51020 [ACK] Seq=1 Ack=13778 Win=56448 Len=0 TSval=1915938413 TSecr=1455333677"
"102","4.104100","222.29.98.58","10.1.246.45","TCP","66","5201  >  51020 [ACK] Seq=1 Ack=22022 Win=72960 Len=0 TSval=1915938417 TSecr=1455333680"
"113","4.104153","222.29.98.58","10.1.246.45","TCP","66","5201  >  51020 [ACK] Seq=1 Ack=27518 Win=83968 Len=0 TSval=1915938417 TSecr=1455333680"
"124","4.104186","222.29.98.58","10.1.246.45","TCP","66","5201  >  51020 [ACK] Seq=1 Ack=31640 Win=92288 Len=0 TSval=1915938417 TSecr=1455333680"
"125","4.104189","222.29.98.58","10.1.246.45","TCP","66","5201  >  51020 [ACK] Seq=1 Ack=35762 Win=100480 Len=0 TSval=1915938417 TSecr=1455333680"
"126","4.104194","222.29.98.58","10.1.246.45","TCP","66","5201  >  51020 [ACK] Seq=1 Ack=39884 Win=108672 Len=0 TSval=1915938417 TSecr=1455333680"
"127","4.104197","222.29.98.58","10.1.246.45","TCP","66","5201  >  51020 [ACK] Seq=1 Ack=41258 Win=111616 Len=0 TSval=1915938421 TSecr=1455333682"
"147","4.106150","222.29.98.58","10.1.246.45","TCP","66","5201  >  51020 [ACK] Seq=1 Ack=46754 Win=122624 Len=0 TSval=1915938426 TSecr=1455333691"
"148","4.106164","222.29.98.58","10.1.246.45","TCP","66","5201  >  51020 [ACK] Seq=1 Ack=48128 Win=125440 Len=0 TSval=1915938426 TSecr=1455333691"
"150","4.108285","222.29.98.58","10.1.246.45","TCP","66","5201  >  51020 [ACK] Seq=1 Ack=52250 Win=133760 Len=0 TSval=1915938427 TSecr=1455333691"
"158","4.108331","222.29.98.58","10.1.246.45","TCP","66","5201  >  51020 [ACK] Seq=1 Ack=59120 Win=147456 Len=0 TSval=1915938427 TSecr=1455333691"
"159","4.108352","222.29.98.58","10.1.246.45","TCP","66","5201  >  51020 [ACK] Seq=1 Ack=63242 Win=155776 Len=0 TSval=1915938428 TSecr=1455333691"
"168","4.108374","222.29.98.58","10.1.246.45","TCP","66","5201  >  51020 [ACK] Seq=1 Ack=68738 Win=166656 Len=0 TSval=1915938428 TSecr=1455333691"
"169","4.111106","222.29.98.58","10.1.246.45","TCP","66","5201  >  51020 [ACK] Seq=1 Ack=79730 Win=188672 Len=0 TSval=1915938430 TSecr=1455333693"
"170","4.111126","222.29.98.58","10.1.246.45","TCP","66","5201  >  51020 [ACK] Seq=1 Ack=82478 Win=194176 Len=0 TSval=1915938430 TSecr=1455333693"
"171","4.111131","222.29.98.58","10.1.246.45","TCP","66","5201  >  51020 [ACK] Seq=1 Ack=94844 Win=218880 Len=0 TSval=1915938430 TSecr=1455333693"
"180","4.112689","222.29.98.58","10.1.246.45","TCP","66","5201  >  51020 [ACK] Seq=1 Ack=96218 Win=221824 Len=0 TSval=1915938431 TSecr=1455333695"
"187","4.114186","222.29.98.58","10.1.246.45","TCP","66","5201  >  51020 [ACK] Seq=1 Ack=105836 Win=241024 Len=0 TSval=1915938434 TSecr=1455333696"
"188","4.114194","222.29.98.58","10.1.246.45","TCP","66","5201  >  51020 [ACK] Seq=1 Ack=112706 Win=254848 Len=0 TSval=1915938434 TSecr=1455333696"
"205","4.115306","222.29.98.58","10.1.246.45","TCP","66","5201  >  51020 [ACK] Seq=1 Ack=116828 Win=263040 Len=0 TSval=1915938435 TSecr=1455333696"
"206","4.117211","222.29.98.58","10.1.246.45","TCP","66","5201  >  51020 [ACK] Seq=1 Ack=118202 Win=265984 Len=0 TSval=1915938435 TSecr=1455333699"
"207","4.117220","222.29.98.58","10.1.246.45","TCP","66","5201  >  51020 [ACK] Seq=1 Ack=125072 Win=279680 Len=0 TSval=1915938437 TSecr=1455333699"
"208","4.117223","222.29.98.58","10.1.246.45","TCP","66","5201  >  51020 [ACK] Seq=1 Ack=127820 Win=285184 Len=0 TSval=1915938437 TSecr=1455333699"
"209","4.119552","222.29.98.58","10.1.246.45","TCP","66","5201  >  51020 [ACK] Seq=1 Ack=136064 Win=280704 Len=0 TSval=1915938437 TSecr=1455333700"
"234","4.125009","222.29.98.58","10.1.246.45","TCP","66","5201  >  51020 [ACK] Seq=1 Ack=147056 Win=285568 Len=0 TSval=1915938443 TSecr=1455333702"
"242","4.125054","222.29.98.58","10.1.246.45","TCP","66","5201  >  51020 [ACK] Seq=1 Ack=158048 Win=285568 Len=0 TSval=1915938443 TSecr=1455333702"
"250","4.125079","222.29.98.58","10.1.246.45","TCP","66","5201  >  51020 [ACK] Seq=1 Ack=164918 Win=288384 Len=0 TSval=1915938444 TSecr=1455333708"
"251","4.127119","222.29.98.58","10.1.246.45","TCP","66","5201  >  51020 [ACK] Seq=1 Ack=166292 Win=292224 Len=0 TSval=1915938445 TSecr=1455333708"
"252","4.127135","222.29.98.58","10.1.246.45","TCP","66","5201  >  51020 [ACK] Seq=1 Ack=177284 Win=285568 Len=0 TSval=1915938445 TSecr=1455333708"
"253","4.127141","222.29.98.58","10.1.246.45","TCP","66","5201  >  51020 [ACK] Seq=1 Ack=180032 Win=283648 Len=0 TSval=1915938446 TSecr=1455333708"
"268","4.129302","222.29.98.58","10.1.246.45","TCP","66","5201  >  51020 [ACK] Seq=1 Ack=184154 Win=290304 Len=0 TSval=1915938447 TSecr=1455333711"
"269","4.129318","222.29.98.58","10.1.246.45","TCP","66","5201  >  51020 [ACK] Seq=1 Ack=188276 Win=287488 Len=0 TSval=1915938447 TSecr=1455333711"
"270","4.129323","222.29.98.58","10.1.246.45","TCP","66","5201  >  51020 [ACK] Seq=1 Ack=191024 Win=291328 Len=0 TSval=1915938447 TSecr=1455333711"
"271","4.129326","222.29.98.58","10.1.246.45","TCP","66","5201  >  51020 [ACK] Seq=1 Ack=195146 Win=290304 Len=0 TSval=1915938447 TSecr=1455333712"
"288","4.130503","222.29.98.58","10.1.246.45","TCP","66","5201  >  51020 [ACK] Seq=1 Ack=202016 Win=288384 Len=0 TSval=1915938450 TSecr=1455333712"
"289","4.130518","222.29.98.58","10.1.246.45","TCP","66","5201  >  51020 [ACK] Seq=1 Ack=206138 Win=285568 Len=0 TSval=1915938451 TSecr=1455333712"
"297","4.132664","222.29.98.58","10.1.246.45","TCP","66","5201  >  51020 [ACK] Seq=1 Ack=210260 Win=282624 Len=0 TSval=1915938451 TSecr=1455333712"
"298","4.132676","222.29.98.58","10.1.246.45","TCP","66","5201  >  51020 [ACK] Seq=1 Ack=218504 Win=287488 Len=0 TSval=1915938452 TSecr=1455333716"
"299","4.136801","222.29.98.58","10.1.246.45","TCP","66","5201  >  51020 [ACK] Seq=1 Ack=229496 Win=293376 Len=0 TSval=1915938452 TSecr=1455333716"
"300","4.136822","222.29.98.58","10.1.246.45","TCP","66","5201  >  51020 [ACK] Seq=1 Ack=241862 Win=293376 Len=0 TSval=1915938455 TSecr=1455333718"
"301","4.136829","222.29.98.58","10.1.246.45","TCP","66","5201  >  51020 [ACK] Seq=1 Ack=247358 Win=293376 Len=0 TSval=1915938455 TSecr=1455333718"
"302","4.136833","222.29.98.58","10.1.246.45","TCP","66","5201  >  51020 [ACK] Seq=1 Ack=251480 Win=293376 Len=0 TSval=1915938455 TSecr=1455333718"
"306","4.136866","222.29.98.58","10.1.246.45","TCP","66","5201  >  51020 [ACK] Seq=1 Ack=255602 Win=293376 Len=0 TSval=1915938456 TSecr=1455333720"
"339","4.141685","222.29.98.58","10.1.246.45","TCP","66","5201  >  51020 [ACK] Seq=1 Ack=265220 Win=293376 Len=0 TSval=1915938461 TSecr=1455333720"
"348","4.141745","222.29.98.58","10.1.246.45","TCP","66","5201  >  51020 [ACK] Seq=1 Ack=273464 Win=293376 Len=0 TSval=1915938461 TSecr=1455333726"
"349","4.141753","222.29.98.58","10.1.246.45","TCP","66","5201  >  51020 [ACK] Seq=1 Ack=276212 Win=293376 Len=0 TSval=1915938462 TSecr=1455333726"
"357","4.151108","222.29.98.58","10.1.246.45","TCP","66","5201  >  51020 [ACK] Seq=1 Ack=285830 Win=293376 Len=0 TSval=1915938463 TSecr=1455333726"
"366","4.151212","222.29.98.58","10.1.246.45","TCP","66","5201  >  51020 [ACK] Seq=1 Ack=298196 Win=293376 Len=0 TSval=1915938463 TSecr=1455333726"
"374","4.151274","222.29.98.58","10.1.246.45","TCP","66","5201  >  51020 [ACK] Seq=1 Ack=309188 Win=293376 Len=0 TSval=1915938464 TSecr=1455333728"
"375","4.151920","222.29.98.58","10.1.246.45","TCP","66","5201  >  51020 [ACK] Seq=1 Ack=316058 Win=293376 Len=0 TSval=1915938469 TSecr=1455333729"
"376","4.151939","222.29.98.58","10.1.246.45","TCP","66","5201  >  51020 [ACK] Seq=1 Ack=320180 Win=293376 Len=0 TSval=1915938470 TSecr=1455333729"
"377","4.151950","222.29.98.58","10.1.246.45","TCP","66","5201  >  51020 [ACK] Seq=1 Ack=327050 Win=293376 Len=0 TSval=1915938471 TSecr=1455333735"
"397","4.154024","222.29.98.58","10.1.246.45","TCP","66","5201  >  51020 [ACK] Seq=1 Ack=329798 Win=293376 Len=0 TSval=1915938472 TSecr=1455333737"
"398","4.154051","222.29.98.58","10.1.246.45","TCP","66","5201  >  51020 [ACK] Seq=1 Ack=336668 Win=293376 Len=0 TSval=1915938473 TSecr=1455333738"
"412","4.156908","222.29.98.58","10.1.246.45","TCP","66","5201  >  51020 [ACK] Seq=1 Ack=350408 Win=293376 Len=0 TSval=1915938475 TSecr=1455333738"
"413","4.157606","222.29.98.58","10.1.246.45","TCP","66","5201  >  51020 [ACK] Seq=1 Ack=358652 Win=293376 Len=0 TSval=1915938476 TSecr=1455333740"
"414","4.157645","222.29.98.58","10.1.246.45","TCP","66","5201  >  51020 [ACK] Seq=1 Ack=373766 Win=293376 Len=0 TSval=1915938477 TSecr=1455333741"
"415","4.157667","222.29.98.58","10.1.246.45","TCP","66","5201  >  51020 [ACK] Seq=1 Ack=376514 Win=293376 Len=0 TSval=1915938477 TSecr=1455333741"
"432","4.162304","222.29.98.58","10.1.246.45","TCP","66","5201  >  51020 [ACK] Seq=1 Ack=394376 Win=293376 Len=0 TSval=1915938480 TSecr=1455333742"
"433","4.163419","222.29.98.58","10.1.246.45","TCP","66","5201  >  51020 [ACK] Seq=1 Ack=397124 Win=293376 Len=0 TSval=1915938483 TSecr=1455333746"
"465","4.222481","222.29.98.58","10.1.246.45","TCP","66","5201  >  51020 [ACK] Seq=1 Ack=416360 Win=293376 Len=0 TSval=1915938540 TSecr=1455333746"
"474","4.222701","222.29.98.58","10.1.246.45","TCP","66","5201  >  51020 [ACK] Seq=1 Ack=435596 Win=293376 Len=0 TSval=1915938542 TSecr=1455333805"
"475","4.222729","222.29.98.58","10.1.246.45","TCP","66","5201  >  51020 [ACK] Seq=1 Ack=441092 Win=293376 Len=0 TSval=1915938542 TSecr=1455333805"
"476","4.222749","222.29.98.58","10.1.246.45","TCP","66","5201  >  51020 [ACK] Seq=1 Ack=450710 Win=293376 Len=0 TSval=1915938543 TSecr=1455333807"
"477","4.222772","222.29.98.58","10.1.246.45","TCP","66","5201  >  51020 [ACK] Seq=1 Ack=453458 Win=293376 Len=0 TSval=1915938543 TSecr=1455333807"
"488","4.224738","222.29.98.58","10.1.246.45","TCP","66","5201  >  51020 [ACK] Seq=1 Ack=457580 Win=293376 Len=0 TSval=1915938543 TSecr=1455333808"
"501","4.228830","222.29.98.58","10.1.246.45","TCP","66","5201  >  51020 [ACK] Seq=1 Ack=469946 Win=293376 Len=0 TSval=1915938546 TSecr=1455333808"
"514","4.232080","222.29.98.58","10.1.246.45","TCP","66","5201  >  51020 [ACK] Seq=1 Ack=483686 Win=293376 Len=0 TSval=1915938550 TSecr=1455333812"
"515","4.232872","222.29.98.58","10.1.246.45","TCP","66","5201  >  51020 [ACK] Seq=1 Ack=496052 Win=293376 Len=0 TSval=1915938552 TSecr=1455333816"
"516","4.232924","222.29.98.58","10.1.246.45","TCP","66","5201  >  51020 [ACK] Seq=1 Ack=498800 Win=293376 Len=0 TSval=1915938552 TSecr=1455333816"
"529","4.237276","222.29.98.58","10.1.246.45","TCP","66","5201  >  51020 [ACK] Seq=1 Ack=515288 Win=293376 Len=0 TSval=1915938556 TSecr=1455333816"
"530","4.237326","222.29.98.58","10.1.246.45","TCP","66","5201  >  51020 [ACK] Seq=1 Ack=516662 Win=296320 Len=0 TSval=1915938557 TSecr=1455333818"
"545","4.241759","222.29.98.58","10.1.246.45","TCP","66","5201  >  51020 [ACK] Seq=1 Ack=518036 Win=299136 Len=0 TSval=1915938560 TSecr=1455333822"
"546","4.242685","222.29.98.58","10.1.246.45","TCP","66","5201  >  51020 [ACK] Seq=1 Ack=529028 Win=321152 Len=0 TSval=1915938562 TSecr=1455333822"
"547","4.242745","222.29.98.58","10.1.246.45","TCP","66","5201  >  51020 [ACK] Seq=1 Ack=533150 Win=329344 Len=0 TSval=1915938562 TSecr=1455333822"
"581","4.246828","222.29.98.58","10.1.246.45","TCP","66","5201  >  51020 [ACK] Seq=1 Ack=545516 Win=354176 Len=0 TSval=1915938566 TSecr=1455333828"
"582","4.246866","222.29.98.58","10.1.246.45","TCP","66","5201  >  51020 [ACK] Seq=1 Ack=552386 Win=367872 Len=0 TSval=1915938566 TSecr=1455333828"
"583","4.249479","222.29.98.58","10.1.246.45","TCP","66","5201  >  51020 [ACK] Seq=1 Ack=562004 Win=387072 Len=0 TSval=1915938568 TSecr=1455333832"
"584","4.249529","222.29.98.58","10.1.246.45","TCP","66","5201  >  51020 [ACK] Seq=1 Ack=571622 Win=406272 Len=0 TSval=1915938568 TSecr=1455333832"
"585","4.249563","222.29.98.58","10.1.246.45","TCP","66","5201  >  51020 [ACK] Seq=1 Ack=581240 Win=425600 Len=0 TSval=1915938569 TSecr=1455333833"
"626","4.260555","222.29.98.58","10.1.246.45","TCP","66","5201  >  51020 [ACK] Seq=1 Ack=583988 Win=431104 Len=0 TSval=1915938575 TSecr=1455333834"
"629","4.260675","222.29.98.58","10.1.246.45","TCP","66","5201  >  51020 [ACK] Seq=1 Ack=588110 Win=439296 Len=0 TSval=1915938575 TSecr=1455333834"
"630","4.260699","222.29.98.58","10.1.246.45","TCP","66","5201  >  51020 [ACK] Seq=1 Ack=597728 Win=458496 Len=0 TSval=1915938575 TSecr=1455333834"
"637","4.260797","222.29.98.58","10.1.246.45","TCP","66","5201  >  51020 [ACK] Seq=1 Ack=601850 Win=466816 Len=0 TSval=1915938576 TSecr=1455333840"
"638","4.260811","222.29.98.58","10.1.246.45","TCP","66","5201  >  51020 [ACK] Seq=1 Ack=619712 Win=501376 Len=0 TSval=1915938577 TSecr=1455333840"
"645","4.261787","222.29.98.58","10.1.246.45","TCP","66","5201  >  51020 [ACK] Seq=1 Ack=623834 Win=510720 Len=0 TSval=1915938577 TSecr=1455333842"
"646","4.261827","222.29.98.58","10.1.246.45","TCP","66","5201  >  51020 [ACK] Seq=1 Ack=632078 Win=510720 Len=0 TSval=1915938578 TSecr=1455333842"
"647","4.261850","222.29.98.58","10.1.246.45","TCP","66","5201  >  51020 [ACK] Seq=1 Ack=644444 Win=510720 Len=0 TSval=1915938579 TSecr=1455333842"
"648","4.261861","222.29.98.58","10.1.246.45","TCP","66","5201  >  51020 [ACK] Seq=1 Ack=647192 Win=512000 Len=0 TSval=1915938580 TSecr=1455333845"
"649","4.261878","222.29.98.58","10.1.246.45","TCP","66","5201  >  51020 [ACK] Seq=1 Ack=651314 Win=514048 Len=0 TSval=1915938580 TSecr=1455333845"
"665","4.264460","222.29.98.58","10.1.246.45","TCP","66","5201  >  51020 [ACK] Seq=1 Ack=655436 Win=514048 Len=0 TSval=1915938583 TSecr=1455333845"
"674","4.265681","222.29.98.58","10.1.246.45","TCP","66","5201  >  51020 [ACK] Seq=1 Ack=671924 Win=514048 Len=0 TSval=1915938585 TSecr=1455333848"
"683","4.270766","222.29.98.58","10.1.246.45","TCP","66","5201  >  51020 [ACK] Seq=1 Ack=688412 Win=514048 Len=0 TSval=1915938587 TSecr=1455333850"
"713","4.273647","222.29.98.58","10.1.246.45","TCP","66","5201  >  51020 [ACK] Seq=1 Ack=699404 Win=514048 Len=0 TSval=1915938592 TSecr=1455333850"
"714","4.273700","222.29.98.58","10.1.246.45","TCP","66","5201  >  51020 [ACK] Seq=1 Ack=703526 Win=514048 Len=0 TSval=1915938592 TSecr=1455333853"
"715","4.275085","222.29.98.58","10.1.246.45","TCP","66","5201  >  51020 [ACK] Seq=1 Ack=714518 Win=514048 Len=0 TSval=1915938593 TSecr=1455333857"
"716","4.275131","222.29.98.58","10.1.246.45","TCP","66","5201  >  51020 [ACK] Seq=1 Ack=721388 Win=514048 Len=0 TSval=1915938595 TSecr=1455333858"
"734","4.277596","222.29.98.58","10.1.246.45","TCP","66","5201  >  51020 [ACK] Seq=1 Ack=729632 Win=514048 Len=0 TSval=1915938595 TSecr=1455333858"
"735","4.280290","222.29.98.58","10.1.246.45","TCP","66","5201  >  51020 [ACK] Seq=1 Ack=733754 Win=514048 Len=0 TSval=1915938599 TSecr=1455333860"
"736","4.280324","222.29.98.58","10.1.246.45","TCP","66","5201  >  51020 [ACK] Seq=1 Ack=754364 Win=514048 Len=0 TSval=1915938600 TSecr=1455333860"
"767","4.283944","222.29.98.58","10.1.246.45","TCP","66","5201  >  51020 [ACK] Seq=1 Ack=757112 Win=514048 Len=0 TSval=1915938604 TSecr=1455333865"
"768","4.283982","222.29.98.58","10.1.246.45","TCP","66","5201  >  51020 [ACK] Seq=1 Ack=777722 Win=514048 Len=0 TSval=1915938604 TSecr=1455333865"
"787","4.286199","222.29.98.58","10.1.246.45","TCP","66","5201  >  51020 [ACK] Seq=1 Ack=780470 Win=514048 Len=0 TSval=1915938605 TSecr=1455333869"
"788","4.286232","222.29.98.58","10.1.246.45","TCP","66","5201  >  51020 [ACK] Seq=1 Ack=794210 Win=514048 Len=0 TSval=1915938606 TSecr=1455333869"
"801","4.288924","222.29.98.58","10.1.246.45","TCP","66","5201  >  51020 [ACK] Seq=1 Ack=801080 Win=514048 Len=0 TSval=1915938608 TSecr=1455333871"
"802","4.288961","222.29.98.58","10.1.246.45","TCP","66","5201  >  51020 [ACK] Seq=1 Ack=818942 Win=514048 Len=0 TSval=1915938608 TSecr=1455333871"
"824","4.290426","222.29.98.58","10.1.246.45","TCP","66","5201  >  51020 [ACK] Seq=1 Ack=825812 Win=514048 Len=0 TSval=1915938610 TSecr=1455333873"
"836","4.292633","222.29.98.58","10.1.246.45","TCP","66","5201  >  51020 [ACK] Seq=1 Ack=843674 Win=514048 Len=0 TSval=1915938610 TSecr=1455333873"
"837","4.292680","222.29.98.58","10.1.246.45","TCP","66","5201  >  51020 [ACK] Seq=1 Ack=860162 Win=514048 Len=0 TSval=1915938612 TSecr=1455333875"
"854","4.297128","222.29.98.58","10.1.246.45","TCP","66","5201  >  51020 [ACK] Seq=1 Ack=871154 Win=514048 Len=0 TSval=1915938613 TSecr=1455333877"
"855","4.297169","222.29.98.58","10.1.246.45","TCP","66","5201  >  51020 [ACK] Seq=1 Ack=875276 Win=514048 Len=0 TSval=1915938614 TSecr=1455333877"
"867","4.297394","222.29.98.58","10.1.246.45","TCP","66","5201  >  51020 [ACK] Seq=1 Ack=882146 Win=514048 Len=0 TSval=1915938614 TSecr=1455333877"
"868","4.297410","222.29.98.58","10.1.246.45","TCP","66","5201  >  51020 [ACK] Seq=1 Ack=889016 Win=514048 Len=0 TSval=1915938614 TSecr=1455333877"
"869","4.297429","222.29.98.58","10.1.246.45","TCP","66","5201  >  51020 [ACK] Seq=1 Ack=894512 Win=514048 Len=0 TSval=1915938617 TSecr=1455333879"
"870","4.297439","222.29.98.58","10.1.246.45","TCP","66","5201  >  51020 [ACK] Seq=1 Ack=897260 Win=514048 Len=0 TSval=1915938617 TSecr=1455333879"
"871","4.300430","222.29.98.58","10.1.246.45","TCP","66","5201  >  51020 [ACK] Seq=1 Ack=904130 Win=514048 Len=0 TSval=1915938617 TSecr=1455333879"
"872","4.300481","222.29.98.58","10.1.246.45","TCP","66","5201  >  51020 [ACK] Seq=1 Ack=911000 Win=514048 Len=0 TSval=1915938619 TSecr=1455333883"
"895","4.303935","222.29.98.58","10.1.246.45","TCP","66","5201  >  51020 [ACK] Seq=1 Ack=920618 Win=514048 Len=0 TSval=1915938621 TSecr=1455333883"
"909","4.305365","222.29.98.58","10.1.246.45","TCP","66","5201  >  51020 [ACK] Seq=1 Ack=935732 Win=514048 Len=0 TSval=1915938623 TSecr=1455333883"
"910","4.305424","222.29.98.58","10.1.246.45","TCP","66","5201  >  51020 [ACK] Seq=1 Ack=941228 Win=514048 Len=0 TSval=1915938623 TSecr=1455333884"
"930","4.309281","222.29.98.58","10.1.246.45","TCP","66","5201  >  51020 [ACK] Seq=1 Ack=954968 Win=514048 Len=0 TSval=1915938624 TSecr=1455333889"
"940","4.309472","222.29.98.58","10.1.246.45","TCP","66","5201  >  51020 [ACK] Seq=1 Ack=967334 Win=514048 Len=0 TSval=1915938626 TSecr=1455333890"
"941","4.309497","222.29.98.58","10.1.246.45","TCP","66","5201  >  51020 [ACK] Seq=1 Ack=971456 Win=514048 Len=0 TSval=1915938626 TSecr=1455333890"
"951","4.310176","222.29.98.58","10.1.246.45","TCP","66","5201  >  51020 [ACK] Seq=1 Ack=987944 Win=514048 Len=0 TSval=1915938627 TSecr=1455333891"
"952","4.310232","222.29.98.58","10.1.246.45","TCP","66","5201  >  51020 [ACK] Seq=1 Ack=990692 Win=514048 Len=0 TSval=1915938628 TSecr=1455333891"
"953","4.310247","222.29.98.58","10.1.246.45","TCP","66","5201  >  51020 [ACK] Seq=1 Ack=996188 Win=514048 Len=0 TSval=1915938630 TSecr=1455333893"
"954","4.310260","222.29.98.58","10.1.246.45","TCP","66","5201  >  51020 [ACK] Seq=1 Ack=1001684 Win=514048 Len=0 TSval=1915938630 TSecr=1455333893"
"975","4.311590","222.29.98.58","10.1.246.45","TCP","66","5201  >  51020 [ACK] Seq=1 Ack=1011302 Win=514048 Len=0 TSval=1915938631 TSecr=1455333895"
"976","4.311622","222.29.98.58","10.1.246.45","TCP","66","5201  >  51020 [ACK] Seq=1 Ack=1015424 Win=514048 Len=0 TSval=1915938631 TSecr=1455333895"
"977","4.311641","222.29.98.58","10.1.246.45","TCP","66","5201  >  51020 [ACK] Seq=1 Ack=1022294 Win=514048 Len=0 TSval=1915938632 TSecr=1455333897"
"978","4.313660","222.29.98.58","10.1.246.45","TCP","66","5201  >  51020 [ACK] Seq=1 Ack=1030538 Win=514048 Len=0 TSval=1915938633 TSecr=1455333897"
"979","4.313695","222.29.98.58","10.1.246.45","TCP","66","5201  >  51020 [ACK] Seq=1 Ack=1040156 Win=514048 Len=0 TSval=1915938633 TSecr=1455333897"
"1005","4.316233","222.29.98.58","10.1.246.45","TCP","66","5201  >  51020 [ACK] Seq=1 Ack=1045652 Win=514048 Len=0 TSval=1915938635 TSecr=1455333898"
"1006","4.316279","222.29.98.58","10.1.246.45","TCP","66","5201  >  51020 [ACK] Seq=1 Ack=1052522 Win=514048 Len=0 TSval=1915938636 TSecr=1455333898"
"1007","4.316295","222.29.98.58","10.1.246.45","TCP","66","5201  >  51020 [ACK] Seq=1 Ack=1060766 Win=514048 Len=0 TSval=1915938636 TSecr=1455333899"
"1024","4.317422","222.29.98.58","10.1.246.45","TCP","66","5201  >  51020 [ACK] Seq=1 Ack=1066262 Win=514048 Len=0 TSval=1915938636 TSecr=1455333899"
"1025","4.317453","222.29.98.58","10.1.246.45","TCP","66","5201  >  51020 [ACK] Seq=1 Ack=1069010 Win=514048 Len=0 TSval=1915938636 TSecr=1455333899"
"1040","4.321005","222.29.98.58","10.1.246.45","TCP","66","5201  >  51020 [ACK] Seq=1 Ack=1078628 Win=514048 Len=0 TSval=1915938639 TSecr=1455333901"
"1054","4.321252","222.29.98.58","10.1.246.45","TCP","66","5201  >  51020 [ACK] Seq=1 Ack=1086872 Win=514048 Len=0 TSval=1915938639 TSecr=1455333901"
"1055","4.321284","222.29.98.58","10.1.246.45","TCP","66","5201  >  51020 [ACK] Seq=1 Ack=1093742 Win=514048 Len=0 TSval=1915938639 TSecr=1455333901"
"1056","4.321298","222.29.98.58","10.1.246.45","TCP","66","5201  >  51020 [ACK] Seq=1 Ack=1101986 Win=514048 Len=0 TSval=1915938639 TSecr=1455333901"
"1075","4.322046","222.29.98.58","10.1.246.45","TCP","66","5201  >  51020 [ACK] Seq=1 Ack=1115726 Win=514048 Len=0 TSval=1915938641 TSecr=1455333904"
"1076","4.323875","222.29.98.58","10.1.246.45","TCP","66","5201  >  51020 [ACK] Seq=1 Ack=1123970 Win=514048 Len=0 TSval=1915938642 TSecr=1455333904"
"1077","4.323902","222.29.98.58","10.1.246.45","TCP","66","5201  >  51020 [ACK] Seq=1 Ack=1126718 Win=514048 Len=0 TSval=1915938642 TSecr=1455333907"
"1078","4.323926","222.29.98.58","10.1.246.45","TCP","66","5201  >  51020 [ACK] Seq=1 Ack=1129466 Win=514048 Len=0 TSval=1915938642 TSecr=1455333907"
"1079","4.323941","222.29.98.58","10.1.246.45","TCP","66","5201  >  51020 [ACK] Seq=1 Ack=1132214 Win=514048 Len=0 TSval=1915938643 TSecr=1455333907"
"1080","4.323960","222.29.98.58","10.1.246.45","TCP","66","5201  >  51020 [ACK] Seq=1 Ack=1137710 Win=514048 Len=0 TSval=1915938644 TSecr=1455333907"
"1081","4.323980","222.29.98.58","10.1.246.45","TCP","66","5201  >  51020 [ACK] Seq=1 Ack=1147328 Win=514048 Len=0 TSval=1915938644 TSecr=1455333907"
"1082","4.323994","222.29.98.58","10.1.246.45","TCP","66","5201  >  51020 [ACK] Seq=1 Ack=1151450 Win=514048 Len=0 TSval=1915938644 TSecr=1455333908"
"1095","4.325097","222.29.98.58","10.1.246.45","TCP","66","5201  >  51020 [ACK] Seq=1 Ack=1158320 Win=514048 Len=0 TSval=1915938645 TSecr=1455333908"
"1096","4.325118","222.29.98.58","10.1.246.45","TCP","66","5201  >  51020 [ACK] Seq=1 Ack=1165190 Win=514048 Len=0 TSval=1915938645 TSecr=1455333908"
"1112","4.328776","222.29.98.58","10.1.246.45","TCP","66","5201  >  51020 [ACK] Seq=1 Ack=1178930 Win=514048 Len=0 TSval=1915938647 TSecr=1455333909"
"1136","4.332257","222.29.98.58","10.1.246.45","TCP","66","5201  >  51020 [ACK] Seq=1 Ack=1187174 Win=514048 Len=0 TSval=1915938648 TSecr=1455333909"
"1137","4.332296","222.29.98.58","10.1.246.45","TCP","66","5201  >  51020 [ACK] Seq=1 Ack=1194044 Win=514048 Len=0 TSval=1915938648 TSecr=1455333912"
"1138","4.332314","222.29.98.58","10.1.246.45","TCP","66","5201  >  51020 [ACK] Seq=1 Ack=1199540 Win=514048 Len=0 TSval=1915938648 TSecr=1455333912"
"1164","4.335144","222.29.98.58","10.1.246.45","TCP","66","5201  >  51020 [ACK] Seq=1 Ack=1210532 Win=514048 Len=0 TSval=1915938653 TSecr=1455333912"
"1165","4.335190","222.29.98.58","10.1.246.45","TCP","66","5201  >  51020 [ACK] Seq=1 Ack=1218776 Win=514048 Len=0 TSval=1915938653 TSecr=1455333913"
"1166","4.335210","222.29.98.58","10.1.246.45","TCP","66","5201  >  51020 [ACK] Seq=1 Ack=1221524 Win=514048 Len=0 TSval=1915938653 TSecr=1455333913"
"1167","4.335230","222.29.98.58","10.1.246.45","TCP","66","5201  >  51020 [ACK] Seq=1 Ack=1224272 Win=514048 Len=0 TSval=1915938654 TSecr=1455333913"
"1168","4.335244","222.29.98.58","10.1.246.45","TCP","66","5201  >  51020 [ACK] Seq=1 Ack=1228394 Win=514048 Len=0 TSval=1915938654 TSecr=1455333919"
"1187","4.336297","222.29.98.58","10.1.246.45","TCP","66","5201  >  51020 [ACK] Seq=1 Ack=1231142 Win=514048 Len=0 TSval=1915938654 TSecr=1455333919"
"1188","4.336316","222.29.98.58","10.1.246.45","TCP","66","5201  >  51020 [ACK] Seq=1 Ack=1236638 Win=514048 Len=0 TSval=1915938655 TSecr=1455333919"
"1189","4.337898","222.29.98.58","10.1.246.45","TCP","66","5201  >  51020 [ACK] Seq=1 Ack=1243508 Win=514048 Len=0 TSval=1915938655 TSecr=1455333919"
"1190","4.337924","222.29.98.58","10.1.246.45","TCP","66","5201  >  51020 [ACK] Seq=1 Ack=1257248 Win=514048 Len=0 TSval=1915938657 TSecr=1455333919"
"1191","4.337950","222.29.98.58","10.1.246.45","TCP","66","5201  >  51020 [ACK] Seq=1 Ack=1269614 Win=514048 Len=0 TSval=1915938657 TSecr=1455333921"
"1217","4.340249","222.29.98.58","10.1.246.45","TCP","66","5201  >  51020 [ACK] Seq=1 Ack=1288850 Win=514048 Len=0 TSval=1915938658 TSecr=1455333921"
"1242","4.341467","222.29.98.58","10.1.246.45","TCP","66","5201  >  51020 [ACK] Seq=1 Ack=1295720 Win=514048 Len=0 TSval=1915938661 TSecr=1455333923"
"1243","4.342858","222.29.98.58","10.1.246.45","TCP","66","5201  >  51020 [ACK] Seq=1 Ack=1313582 Win=514048 Len=0 TSval=1915938661 TSecr=1455333923"
"1257","4.343078","222.29.98.58","10.1.246.45","TCP","66","5201  >  51020 [ACK] Seq=1 Ack=1330070 Win=514048 Len=0 TSval=1915938662 TSecr=1455333926"
"1272","4.344131","222.29.98.58","10.1.246.45","TCP","66","5201  >  51020 [ACK] Seq=1 Ack=1332818 Win=514048 Len=0 TSval=1915938663 TSecr=1455333926"
"1280","4.345704","222.29.98.58","10.1.246.45","TCP","66","5201  >  51020 [ACK] Seq=1 Ack=1347932 Win=514048 Len=0 TSval=1915938663 TSecr=1455333926"
"1295","4.345850","222.29.98.58","10.1.246.45","TCP","66","5201  >  51020 [ACK] Seq=1 Ack=1357550 Win=514048 Len=0 TSval=1915938665 TSecr=1455333928"
"1296","4.345868","222.29.98.58","10.1.246.45","TCP","66","5201  >  51020 [ACK] Seq=1 Ack=1375412 Win=514048 Len=0 TSval=1915938665 TSecr=1455333928"
"1312","4.351198","222.29.98.58","10.1.246.45","TCP","66","5201  >  51020 [ACK] Seq=1 Ack=1380908 Win=514048 Len=0 TSval=1915938665 TSecr=1455333928"
"1313","4.351239","222.29.98.58","10.1.246.45","TCP","66","5201  >  51020 [ACK] Seq=1 Ack=1386404 Win=514048 Len=0 TSval=1915938668 TSecr=1455333930"
"1314","4.351251","222.29.98.58","10.1.246.45","TCP","66","5201  >  51020 [ACK] Seq=1 Ack=1394648 Win=514048 Len=0 TSval=1915938668 TSecr=1455333930"
"1315","4.351263","222.29.98.58","10.1.246.45","TCP","66","5201  >  51020 [ACK] Seq=1 Ack=1402892 Win=514048 Len=0 TSval=1915938668 TSecr=1455333930"
"1316","4.351286","222.29.98.58","10.1.246.45","TCP","66","5201  >  51020 [ACK] Seq=1 Ack=1407014 Win=514048 Len=0 TSval=1915938668 TSecr=1455333931"
"1317","4.351298","222.29.98.58","10.1.246.45","TCP","66","5201  >  51020 [ACK] Seq=1 Ack=1413884 Win=514048 Len=0 TSval=1915938668 TSecr=1455333931"
"1318","4.351307","222.29.98.58","10.1.246.45","TCP","66","5201  >  51020 [ACK] Seq=1 Ack=1419380 Win=514048 Len=0 TSval=1915938669 TSecr=1455333931"
"1319","4.351319","222.29.98.58","10.1.246.45","TCP","66","5201  >  51020 [ACK] Seq=1 Ack=1428998 Win=514048 Len=0 TSval=1915938669 TSecr=1455333933"
"1362","4.355178","222.29.98.58","10.1.246.45","TCP","66","5201  >  51020 [ACK] Seq=1 Ack=1438616 Win=514048 Len=0 TSval=1915938675 TSecr=1455333933"
"1363","4.355203","222.29.98.58","10.1.246.45","TCP","66","5201  >  51020 [ACK] Seq=1 Ack=1445486 Win=514048 Len=0 TSval=1915938675 TSecr=1455333933"
"1364","4.355221","222.29.98.58","10.1.246.45","TCP","66","5201  >  51020 [ACK] Seq=1 Ack=1453730 Win=514048 Len=0 TSval=1915938675 TSecr=1455333933"
"1365","4.355230","222.29.98.58","10.1.246.45","TCP","66","5201  >  51020 [ACK] Seq=1 Ack=1457852 Win=514048 Len=0 TSval=1915938675 TSecr=1455333934"
"1377","4.357214","222.29.98.58","10.1.246.45","TCP","66","5201  >  51020 [ACK] Seq=1 Ack=1467470 Win=514048 Len=0 TSval=1915938675 TSecr=1455333934"
"1378","4.357237","222.29.98.58","10.1.246.45","TCP","66","5201  >  51020 [ACK] Seq=1 Ack=1483958 Win=514048 Len=0 TSval=1915938677 TSecr=1455333940"
"1379","4.357254","222.29.98.58","10.1.246.45","TCP","66","5201  >  51020 [ACK] Seq=1 Ack=1489454 Win=514048 Len=0 TSval=1915938677 TSecr=1455333942"
"1404","4.358984","222.29.98.58","10.1.246.45","TCP","66","5201  >  51020 [ACK] Seq=1 Ack=1492202 Win=514048 Len=0 TSval=1915938677 TSecr=1455333942"
"1405","4.359011","222.29.98.58","10.1.246.45","TCP","66","5201  >  51020 [ACK] Seq=1 Ack=1496324 Win=514048 Len=0 TSval=1915938679 TSecr=1455333942"
"1418","4.360596","222.29.98.58","10.1.246.45","TCP","66","5201  >  51020 [ACK] Seq=1 Ack=1510064 Win=514048 Len=0 TSval=1915938679 TSecr=1455333942"
"1432","4.360735","222.29.98.58","10.1.246.45","TCP","66","5201  >  51020 [ACK] Seq=1 Ack=1525178 Win=514048 Len=0 TSval=1915938679 TSecr=1455333942"
"1433","4.361671","222.29.98.58","10.1.246.45","TCP","66","5201  >  51020 [ACK] Seq=1 Ack=1534796 Win=514048 Len=0 TSval=1915938680 TSecr=1455333944"
"1434","4.361697","222.29.98.58","10.1.246.45","TCP","66","5201  >  51020 [ACK] Seq=1 Ack=1540292 Win=514048 Len=0 TSval=1915938680 TSecr=1455333944"
"1435","4.361713","222.29.98.58","10.1.246.45","TCP","66","5201  >  51020 [ACK] Seq=1 Ack=1549910 Win=514048 Len=0 TSval=1915938682 TSecr=1455333945"
"1436","4.361724","222.29.98.58","10.1.246.45","TCP","66","5201  >  51020 [ACK] Seq=1 Ack=1556780 Win=514048 Len=0 TSval=1915938682 TSecr=1455333945"
"1464","4.362965","222.29.98.58","10.1.246.45","TCP","66","5201  >  51020 [ACK] Seq=1 Ack=1573268 Win=514048 Len=0 TSval=1915938683 TSecr=1455333945"
"1482","4.366019","222.29.98.58","10.1.246.45","TCP","66","5201  >  51020 [ACK] Seq=1 Ack=1577390 Win=514048 Len=0 TSval=1915938683 TSecr=1455333948"
"1483","4.366056","222.29.98.58","10.1.246.45","TCP","66","5201  >  51020 [ACK] Seq=1 Ack=1589756 Win=514048 Len=0 TSval=1915938684 TSecr=1455333948"
"1484","4.369313","222.29.98.58","10.1.246.45","TCP","66","5201  >  51020 [ACK] Seq=1 Ack=1606244 Win=514048 Len=0 TSval=1915938685 TSecr=1455333948"
"1485","4.369353","222.29.98.58","10.1.246.45","TCP","66","5201  >  51020 [ACK] Seq=1 Ack=1614488 Win=514048 Len=0 TSval=1915938686 TSecr=1455333948"
"1486","4.369375","222.29.98.58","10.1.246.45","TCP","66","5201  >  51020 [ACK] Seq=1 Ack=1621358 Win=514048 Len=0 TSval=1915938686 TSecr=1455333950"
"1530","4.372539","222.29.98.58","10.1.246.45","TCP","66","5201  >  51020 [ACK] Seq=1 Ack=1632350 Win=514048 Len=0 TSval=1915938693 TSecr=1455333950"
"1531","4.372572","222.29.98.58","10.1.246.45","TCP","66","5201  >  51020 [ACK] Seq=1 Ack=1643342 Win=514048 Len=0 TSval=1915938693 TSecr=1455333950"
"1532","4.374157","222.29.98.58","10.1.246.45","TCP","66","5201  >  51020 [ACK] Seq=1 Ack=1652960 Win=514048 Len=0 TSval=1915938693 TSecr=1455333950"
"1533","4.374190","222.29.98.58","10.1.246.45","TCP","66","5201  >  51020 [ACK] Seq=1 Ack=1668074 Win=514048 Len=0 TSval=1915938694 TSecr=1455333951"
"1546","4.379026","222.29.98.58","10.1.246.45","TCP","66","5201  >  51020 [ACK] Seq=1 Ack=1685936 Win=514048 Len=0 TSval=1915938695 TSecr=1455333958"
"1564","4.380094","222.29.98.58","10.1.246.45","TCP","66","5201  >  51020 [ACK] Seq=1 Ack=1694180 Win=514048 Len=0 TSval=1915938700 TSecr=1455333959"
"1577","4.381340","222.29.98.58","10.1.246.45","TCP","66","5201  >  51020 [ACK] Seq=1 Ack=1702424 Win=514048 Len=0 TSval=1915938701 TSecr=1455333959"
"1578","4.381370","222.29.98.58","10.1.246.45","TCP","66","5201  >  51020 [ACK] Seq=1 Ack=1727156 Win=514048 Len=0 TSval=1915938701 TSecr=1455333959"
"1590","4.382435","222.29.98.58","10.1.246.45","TCP","66","5201  >  51020 [ACK] Seq=1 Ack=1743644 Win=514048 Len=0 TSval=1915938702 TSecr=1455333966"
"1615","4.383610","222.29.98.58","10.1.246.45","TCP","66","5201  >  51020 [ACK] Seq=1 Ack=1747766 Win=514048 Len=0 TSval=1915938703 TSecr=1455333967"
"1616","4.383642","222.29.98.58","10.1.246.45","TCP","66","5201  >  51020 [ACK] Seq=1 Ack=1765628 Win=514048 Len=0 TSval=1915938703 TSecr=1455333967"
"1643","4.385946","222.29.98.58","10.1.246.45","TCP","66","5201  >  51020 [ACK] Seq=1 Ack=1773872 Win=514048 Len=0 TSval=1915938704 TSecr=1455333967"
"1644","4.386001","222.29.98.58","10.1.246.45","TCP","66","5201  >  51020 [ACK] Seq=1 Ack=1783490 Win=514048 Len=0 TSval=1915938704 TSecr=1455333968"
"1645","4.386019","222.29.98.58","10.1.246.45","TCP","66","5201  >  51020 [ACK] Seq=1 Ack=1790360 Win=514048 Len=0 TSval=1915938705 TSecr=1455333969"
"1646","4.386037","222.29.98.58","10.1.246.45","TCP","66","5201  >  51020 [ACK] Seq=1 Ack=1798604 Win=514048 Len=0 TSval=1915938705 TSecr=1455333969"
"1647","4.390021","222.29.98.58","10.1.246.45","TCP","66","5201  >  51020 [ACK] Seq=1 Ack=1806848 Win=514048 Len=0 TSval=1915938707 TSecr=1455333971"
"1648","4.390065","222.29.98.58","10.1.246.45","TCP","66","5201  >  51020 [ACK] Seq=1 Ack=1831580 Win=514048 Len=0 TSval=1915938708 TSecr=1455333971"
"1705","4.392062","222.29.98.58","10.1.246.45","TCP","66","5201  >  51020 [ACK] Seq=1 Ack=1839824 Win=514048 Len=0 TSval=1915938712 TSecr=1455333973"
"1706","4.392095","222.29.98.58","10.1.246.45","TCP","66","5201  >  51020 [ACK] Seq=1 Ack=1849442 Win=514048 Len=0 TSval=1915938712 TSecr=1455333973"
"1707","4.392115","222.29.98.58","10.1.246.45","TCP","66","5201  >  51020 [ACK] Seq=1 Ack=1859060 Win=514048 Len=0 TSval=1915938712 TSecr=1455333973"
"1724","4.393738","222.29.98.58","10.1.246.45","TCP","66","5201  >  51020 [ACK] Seq=1 Ack=1864556 Win=514048 Len=0 TSval=1915938712 TSecr=1455333973"
"1725","4.393775","222.29.98.58","10.1.246.45","TCP","66","5201  >  51020 [ACK] Seq=1 Ack=1867304 Win=514048 Len=0 TSval=1915938713 TSecr=1455333973"
"1726","4.394980","222.29.98.58","10.1.246.45","TCP","66","5201  >  51020 [ACK] Seq=1 Ack=1879670 Win=514048 Len=0 TSval=1915938713 TSecr=1455333977"
"1727","4.395034","222.29.98.58","10.1.246.45","TCP","66","5201  >  51020 [ACK] Seq=1 Ack=1882418 Win=514048 Len=0 TSval=1915938714 TSecr=1455333977"
"1728","4.395051","222.29.98.58","10.1.246.45","TCP","66","5201  >  51020 [ACK] Seq=1 Ack=1901654 Win=514048 Len=0 TSval=1915938714 TSecr=1455333977"
"1729","4.395060","222.29.98.58","10.1.246.45","TCP","66","5201  >  51020 [ACK] Seq=1 Ack=1923638 Win=514048 Len=0 TSval=1915938715 TSecr=1455333978"
"1730","4.398464","222.29.98.58","10.1.246.45","TCP","66","5201  >  51020 [ACK] Seq=1 Ack=1940126 Win=514048 Len=0 TSval=1915938716 TSecr=1455333979"
"1796","4.401821","222.29.98.58","10.1.246.45","TCP","66","5201  >  51020 [ACK] Seq=1 Ack=1953866 Win=514048 Len=0 TSval=1915938722 TSecr=1455333979"
"1797","4.401848","222.29.98.58","10.1.246.45","TCP","66","5201  >  51020 [ACK] Seq=1 Ack=1963484 Win=514048 Len=0 TSval=1915938722 TSecr=1455333980"
"1798","4.402794","222.29.98.58","10.1.246.45","TCP","66","5201  >  51020 [ACK] Seq=1 Ack=1966232 Win=514048 Len=0 TSval=1915938722 TSecr=1455333980"
"1799","4.402823","222.29.98.58","10.1.246.45","TCP","66","5201  >  51020 [ACK] Seq=1 Ack=1978598 Win=514048 Len=0 TSval=1915938722 TSecr=1455333987"
"1828","4.406330","222.29.98.58","10.1.246.45","TCP","66","5201  >  51020 [ACK] Seq=1 Ack=1984094 Win=514048 Len=0 TSval=1915938723 TSecr=1455333987"
"1829","4.406369","222.29.98.58","10.1.246.45","TCP","66","5201  >  51020 [ACK] Seq=1 Ack=2008826 Win=514048 Len=0 TSval=1915938724 TSecr=1455333987"
"1830","4.406387","222.29.98.58","10.1.246.45","TCP","66","5201  >  51020 [ACK] Seq=1 Ack=2015696 Win=514048 Len=0 TSval=1915938725 TSecr=1455333989"
"1831","4.406400","222.29.98.58","10.1.246.45","TCP","66","5201  >  51020 [ACK] Seq=1 Ack=2032184 Win=514048 Len=0 TSval=1915938725 TSecr=1455333989"
"1832","4.406409","222.29.98.58","10.1.246.45","TCP","66","5201  >  51020 [ACK] Seq=1 Ack=2034932 Win=514048 Len=0 TSval=1915938726 TSecr=1455333989"
"1833","4.407909","222.29.98.58","10.1.246.45","TCP","66","5201  >  51020 [ACK] Seq=1 Ack=2055542 Win=514048 Len=0 TSval=1915938726 TSecr=1455333989"
"1866","4.409769","222.29.98.58","10.1.246.45","TCP","66","5201  >  51020 [ACK] Seq=1 Ack=2058290 Win=514048 Len=0 TSval=1915938729 TSecr=1455333991"
"1867","4.410717","222.29.98.58","10.1.246.45","TCP","66","5201  >  51020 [ACK] Seq=1 Ack=2066534 Win=514048 Len=0 TSval=1915938730 TSecr=1455333991"
"1868","4.410746","222.29.98.58","10.1.246.45","TCP","66","5201  >  51020 [ACK] Seq=1 Ack=2072030 Win=514048 Len=0 TSval=1915938731 TSecr=1455333991"
"1869","4.412509","222.29.98.58","10.1.246.45","TCP","66","5201  >  51020 [ACK] Seq=1 Ack=2081648 Win=514048 Len=0 TSval=1915938731 TSecr=1455333991"
"1870","4.412538","222.29.98.58","10.1.246.45","TCP","66","5201  >  51020 [ACK] Seq=1 Ack=2085770 Win=514048 Len=0 TSval=1915938731 TSecr=1455333991"
"1871","4.414999","222.29.98.58","10.1.246.45","TCP","66","5201  >  51020 [ACK] Seq=1 Ack=2094014 Win=514048 Len=0 TSval=1915938732 TSecr=1455333991"
"1872","4.421433","222.29.98.58","10.1.246.45","TCP","66","5201  >  51020 [ACK] Seq=1 Ack=2103632 Win=514048 Len=0 TSval=1915938741 TSecr=1455333997"
"1903","4.423530","222.29.98.58","10.1.246.45","TCP","66","5201  >  51020 [ACK] Seq=1 Ack=2114624 Win=514048 Len=0 TSval=1915938743 TSecr=1455333997"
"1904","4.424405","222.29.98.58","10.1.246.45","TCP","66","5201  >  51020 [ACK] Seq=1 Ack=2122868 Win=514048 Len=0 TSval=1915938744 TSecr=1455333997"
"1905","4.424434","222.29.98.58","10.1.246.45","TCP","66","5201  >  51020 [ACK] Seq=1 Ack=2137982 Win=514048 Len=0 TSval=1915938744 TSecr=1455333997"
"1906","4.424451","222.29.98.58","10.1.246.45","TCP","66","5201  >  51020 [ACK] Seq=1 Ack=2146226 Win=514048 Len=0 TSval=1915938745 TSecr=1455334009"
"1907","4.424460","222.29.98.58","10.1.246.45","TCP","66","5201  >  51020 [ACK] Seq=1 Ack=2151722 Win=514048 Len=0 TSval=1915938745 TSecr=1455334009"
"1918","4.431761","222.29.98.58","10.1.246.45","TCP","66","5201  >  51020 [ACK] Seq=1 Ack=2155844 Win=514048 Len=0 TSval=1915938746 TSecr=1455334009"
"1938","4.434549","222.29.98.58","10.1.246.45","TCP","66","5201  >  51020 [ACK] Seq=1 Ack=2165462 Win=514048 Len=0 TSval=1915938754 TSecr=1455334010"
"1939","4.434590","222.29.98.58","10.1.246.45","TCP","66","5201  >  51020 [ACK] Seq=1 Ack=2172332 Win=514048 Len=0 TSval=1915938754 TSecr=1455334010"
"1940","4.438096","222.29.98.58","10.1.246.45","TCP","66","5201  >  51020 [ACK] Seq=1 Ack=2179202 Win=514048 Len=0 TSval=1915938754 TSecr=1455334010"
"1941","4.438126","222.29.98.58","10.1.246.45","TCP","66","5201  >  51020 [ACK] Seq=1 Ack=2183324 Win=514048 Len=0 TSval=1915938754 TSecr=1455334019"
"1942","4.438142","222.29.98.58","10.1.246.45","TCP","66","5201  >  51020 [ACK] Seq=1 Ack=2192942 Win=514048 Len=0 TSval=1915938755 TSecr=1455334019"
"1977","4.441066","222.29.98.58","10.1.246.45","TCP","66","5201  >  51020 [ACK] Seq=1 Ack=2208056 Win=514048 Len=0 TSval=1915938761 TSecr=1455334020"
