"No.","Time","Source","Destination","Protocol","Length","Info"
"83469","18.767264","10.1.246.45","222.29.98.58","MPTCP","154","[TCP Out-Of-Order] 51018  >  5201 [SYN] Seq=0 Win=29200 Len=0 MSS=1460 SACK_PERM=1 TSval=1455333552 TSecr=0 WS=128"
"83470","18.767867","10.1.246.45","222.29.98.58","MPTCP","154","[TCP Out-Of-Order] 51018  >  5201 [SYN] Seq=0 Win=29200 Len=0 MSS=1460 SACK_PERM=1 TSval=1455333552 TSecr=0 WS=128"
"84129","18.893936","10.1.246.45","222.29.98.58","TCP","1516","[TCP Out-Of-Order] 51020  >  5201 [ACK] Seq=13778 Ack=1 Win=29312 Len=1374 TSval=1455333680 TSecr=1915938412"
"84130","18.893981","10.1.246.45","222.29.98.58","TCP","1516","[TCP Out-Of-Order] 51020  >  5201 [ACK] Seq=15152 Ack=1 Win=29312 Len=1374 TSval=1455333680 TSecr=1915938412"
"84131","18.894027","10.1.246.45","222.29.98.58","TCP","1516","[TCP Out-Of-Order] 51020  >  5201 [ACK] Seq=16526 Ack=1 Win=29312 Len=1374 TSval=1455333680 TSecr=1915938412"
"84132","18.894072","10.1.246.45","222.29.98.58","TCP","1516","[TCP Out-Of-Order] 51020  >  5201 [ACK] Seq=17900 Ack=1 Win=29312 Len=1374 TSval=1455333680 TSecr=1915938412"
"84133","18.894118","10.1.246.45","222.29.98.58","TCP","1516","[TCP Out-Of-Order] 51020  >  5201 [ACK] Seq=19274 Ack=1 Win=29312 Len=1374 TSval=1455333680 TSecr=1915938412"
"84201","18.907425","10.1.246.45","222.29.98.58","TCP","1516","[TCP Out-Of-Order] 51020  >  5201 [ACK] Seq=68738 Ack=1 Win=29312 Len=1374 TSval=1455333693 TSecr=1915938421"
"84202","18.907470","10.1.246.45","222.29.98.58","TCP","1516","[TCP Out-Of-Order] 51020  >  5201 [ACK] Seq=70112 Ack=1 Win=29312 Len=1374 TSval=1455333693 TSecr=1915938421"
"84203","18.907515","10.1.246.45","222.29.98.58","TCP","1516","[TCP Out-Of-Order] 51020  >  5201 [ACK] Seq=71486 Ack=1 Win=29312 Len=1374 TSval=1455333693 TSecr=1915938421"
"84204","18.907560","10.1.246.45","222.29.98.58","TCP","1516","[TCP Out-Of-Order] 51020  >  5201 [ACK] Seq=72860 Ack=1 Win=29312 Len=1374 TSval=1455333693 TSecr=1915938421"
"84205","18.907605","10.1.246.45","222.29.98.58","TCP","1516","[TCP Out-Of-Order] 51020  >  5201 [ACK] Seq=74234 Ack=1 Win=29312 Len=1374 TSval=1455333693 TSecr=1915938421"
"84232","18.909841","10.1.246.45","222.29.98.58","TCP","1516","[TCP Out-Of-Order] 51020  >  5201 [ACK] Seq=96218 Ack=1 Win=29312 Len=1374 TSval=1455333696 TSecr=1915938427"
"84233","18.909888","10.1.246.45","222.29.98.58","TCP","1516","[TCP Out-Of-Order] 51020  >  5201 [ACK] Seq=97592 Ack=1 Win=29312 Len=1374 TSval=1455333696 TSecr=1915938427"
"84234","18.909933","10.1.246.45","222.29.98.58","TCP","1516","[TCP Out-Of-Order] 51020  >  5201 [ACK] Seq=98966 Ack=1 Win=29312 Len=1374 TSval=1455333696 TSecr=1915938427"
"84235","18.909979","10.1.246.45","222.29.98.58","TCP","1516","[TCP Out-Of-Order] 51020  >  5201 [ACK] Seq=100340 Ack=1 Win=29312 Len=1374 TSval=1455333696 TSecr=1915938427"
"84236","18.910025","10.1.246.45","222.29.98.58","TCP","1516","[TCP Out-Of-Order] 51020  >  5201 [ACK] Seq=101714 Ack=1 Win=29312 Len=1374 TSval=1455333696 TSecr=1915938427"
"84237","18.910071","10.1.246.45","222.29.98.58","TCP","1516","[TCP Out-Of-Order] 51020  >  5201 [ACK] Seq=103088 Ack=1 Win=29312 Len=1374 TSval=1455333696 TSecr=1915938427"
"84238","18.910144","10.1.246.45","222.29.98.58","TCP","1516","[TCP Out-Of-Order] 51020  >  5201 [ACK] Seq=104462 Ack=1 Win=29312 Len=1374 TSval=1455333696 TSecr=1915938427"
"84239","18.910191","10.1.246.45","222.29.98.58","TCP","1516","[TCP Out-Of-Order] 51020  >  5201 [ACK] Seq=105836 Ack=1 Win=29312 Len=1374 TSval=1455333696 TSecr=1915938428"
"84240","18.910236","10.1.246.45","222.29.98.58","TCP","1516","[TCP Out-Of-Order] 51020  >  5201 [ACK] Seq=107210 Ack=1 Win=29312 Len=1374 TSval=1455333696 TSecr=1915938428"
"84241","18.910281","10.1.246.45","222.29.98.58","TCP","1516","[TCP Out-Of-Order] 51020  >  5201 [ACK] Seq=108584 Ack=1 Win=29312 Len=1374 TSval=1455333696 TSecr=1915938428"
"84242","18.910327","10.1.246.45","222.29.98.58","TCP","1516","[TCP Out-Of-Order] 51020  >  5201 [ACK] Seq=109958 Ack=1 Win=29312 Len=1374 TSval=1455333696 TSecr=1915938428"
"84243","18.910372","10.1.246.45","222.29.98.58","TCP","1516","[TCP Out-Of-Order] 51020  >  5201 [ACK] Seq=111332 Ack=1 Win=29312 Len=1374 TSval=1455333696 TSecr=1915938428"
"84244","18.910417","10.1.246.45","222.29.98.58","TCP","1516","[TCP Out-Of-Order] 51020  >  5201 [ACK] Seq=112706 Ack=1 Win=29312 Len=1374 TSval=1455333696 TSecr=1915938428"
"84245","18.910490","10.1.246.45","222.29.98.58","TCP","1516","[TCP Out-Of-Order] 51020  >  5201 [ACK] Seq=114080 Ack=1 Win=29312 Len=1374 TSval=1455333696 TSecr=1915938428"
"84251","18.910809","10.1.246.45","222.29.98.58","TCP","1516","[TCP Out-Of-Order] 51020  >  5201 [ACK] Seq=96218 Ack=1 Win=29312 Len=1374 TSval=1455333696 TSecr=1915938427"
"84252","18.911023","10.1.246.45","222.29.98.58","TCP","1516","[TCP Out-Of-Order] 51020  >  5201 [ACK] Seq=97592 Ack=1 Win=29312 Len=1374 TSval=1455333696 TSecr=1915938427"
"84253","18.911070","10.1.246.45","222.29.98.58","TCP","1516","[TCP Out-Of-Order] 51020  >  5201 [ACK] Seq=98966 Ack=1 Win=29312 Len=1374 TSval=1455333696 TSecr=1915938427"
"84254","18.911117","10.1.246.45","222.29.98.58","TCP","1516","[TCP Out-Of-Order] 51020  >  5201 [ACK] Seq=100340 Ack=1 Win=29312 Len=1374 TSval=1455333696 TSecr=1915938427"
"84255","18.911162","10.1.246.45","222.29.98.58","TCP","1516","[TCP Out-Of-Order] 51020  >  5201 [ACK] Seq=101714 Ack=1 Win=29312 Len=1374 TSval=1455333696 TSecr=1915938427"
"84256","18.911235","10.1.246.45","222.29.98.58","TCP","1516","[TCP Out-Of-Order] 51020  >  5201 [ACK] Seq=103088 Ack=1 Win=29312 Len=1374 TSval=1455333696 TSecr=1915938427"
"84257","18.911281","10.1.246.45","222.29.98.58","TCP","1516","[TCP Out-Of-Order] 51020  >  5201 [ACK] Seq=104462 Ack=1 Win=29312 Len=1374 TSval=1455333696 TSecr=1915938427"
"84258","18.911325","10.1.246.45","222.29.98.58","TCP","1516","[TCP Out-Of-Order] 51020  >  5201 [ACK] Seq=105836 Ack=1 Win=29312 Len=1374 TSval=1455333696 TSecr=1915938428"
"84259","18.911370","10.1.246.45","222.29.98.58","TCP","1516","[TCP Out-Of-Order] 51020  >  5201 [ACK] Seq=107210 Ack=1 Win=29312 Len=1374 TSval=1455333696 TSecr=1915938428"
"84260","18.911415","10.1.246.45","222.29.98.58","TCP","1516","[TCP Out-Of-Order] 51020  >  5201 [ACK] Seq=108584 Ack=1 Win=29312 Len=1374 TSval=1455333696 TSecr=1915938428"
"84261","18.911488","10.1.246.45","222.29.98.58","TCP","1516","[TCP Out-Of-Order] 51020  >  5201 [ACK] Seq=109958 Ack=1 Win=29312 Len=1374 TSval=1455333696 TSecr=1915938428"
"84262","18.911533","10.1.246.45","222.29.98.58","TCP","1516","[TCP Out-Of-Order] 51020  >  5201 [ACK] Seq=111332 Ack=1 Win=29312 Len=1374 TSval=1455333696 TSecr=1915938428"
"84263","18.911579","10.1.246.45","222.29.98.58","TCP","1516","[TCP Out-Of-Order] 51020  >  5201 [ACK] Seq=112706 Ack=1 Win=29312 Len=1374 TSval=1455333696 TSecr=1915938428"
"84264","18.911624","10.1.246.45","222.29.98.58","TCP","1516","[TCP Out-Of-Order] 51020  >  5201 [ACK] Seq=114080 Ack=1 Win=29312 Len=1374 TSval=1455333696 TSecr=1915938428"
"84280","18.913073","10.1.246.45","222.29.98.58","TCP","1516","[TCP Out-Of-Order] 51020  >  5201 [ACK] Seq=118202 Ack=1 Win=29312 Len=1374 TSval=1455333699 TSecr=1915938430"
"84281","18.913120","10.1.246.45","222.29.98.58","TCP","1516","[TCP Out-Of-Order] 51020  >  5201 [ACK] Seq=119576 Ack=1 Win=29312 Len=1374 TSval=1455333699 TSecr=1915938430"
"84282","18.913165","10.1.246.45","222.29.98.58","TCP","1516","[TCP Out-Of-Order] 51020  >  5201 [ACK] Seq=120950 Ack=1 Win=29312 Len=1374 TSval=1455333699 TSecr=1915938430"
"84283","18.913209","10.1.246.45","222.29.98.58","TCP","1516","[TCP Out-Of-Order] 51020  >  5201 [ACK] Seq=122324 Ack=1 Win=29312 Len=1374 TSval=1455333699 TSecr=1915938430"
"84284","18.913254","10.1.246.45","222.29.98.58","TCP","1516","[TCP Out-Of-Order] 51020  >  5201 [ACK] Seq=123698 Ack=1 Win=29312 Len=1374 TSval=1455333699 TSecr=1915938430"
"84285","18.913299","10.1.246.45","222.29.98.58","TCP","1516","[TCP Out-Of-Order] 51020  >  5201 [ACK] Seq=125072 Ack=1 Win=29312 Len=1374 TSval=1455333699 TSecr=1915938430"
"84297","18.914429","10.1.246.45","222.29.98.58","TCP","1516","[TCP Out-Of-Order] 51020  >  5201 [ACK] Seq=118202 Ack=1 Win=29312 Len=1374 TSval=1455333699 TSecr=1915938430"
"84298","18.914474","10.1.246.45","222.29.98.58","TCP","1516","[TCP Out-Of-Order] 51020  >  5201 [ACK] Seq=119576 Ack=1 Win=29312 Len=1374 TSval=1455333699 TSecr=1915938430"
"84299","18.914518","10.1.246.45","222.29.98.58","TCP","1516","[TCP Out-Of-Order] 51020  >  5201 [ACK] Seq=120950 Ack=1 Win=29312 Len=1374 TSval=1455333699 TSecr=1915938430"
"84300","18.914563","10.1.246.45","222.29.98.58","TCP","1516","[TCP Out-Of-Order] 51020  >  5201 [ACK] Seq=122324 Ack=1 Win=29312 Len=1374 TSval=1455333699 TSecr=1915938430"
"84301","18.914608","10.1.246.45","222.29.98.58","TCP","1516","[TCP Out-Of-Order] 51020  >  5201 [ACK] Seq=123698 Ack=1 Win=29312 Len=1374 TSval=1455333699 TSecr=1915938430"
"84302","18.914653","10.1.246.45","222.29.98.58","TCP","1516","[TCP Out-Of-Order] 51020  >  5201 [ACK] Seq=125072 Ack=1 Win=29312 Len=1374 TSval=1455333699 TSecr=1915938430"
"84303","18.914727","10.1.246.45","222.29.98.58","TCP","1508","[TCP Out-Of-Order] 51020  >  5201 [ACK] Seq=126446 Ack=1 Win=29312 Len=1374 TSval=1455333699 TSecr=1915938430"
"84330","18.917732","10.1.246.45","222.29.98.58","TCP","1516","[TCP Out-Of-Order] 51020  >  5201 [ACK] Seq=136064 Ack=1 Win=29312 Len=1374 TSval=1455333702 TSecr=1915938434"
"84331","18.917782","10.1.246.45","222.29.98.58","TCP","1516","[TCP Out-Of-Order] 51020  >  5201 [ACK] Seq=137438 Ack=1 Win=29312 Len=1374 TSval=1455333702 TSecr=1915938434"
"84332","18.917829","10.1.246.45","222.29.98.58","TCP","1516","[TCP Out-Of-Order] 51020  >  5201 [ACK] Seq=138812 Ack=1 Win=29312 Len=1374 TSval=1455333702 TSecr=1915938434"
"84333","18.917876","10.1.246.45","222.29.98.58","TCP","1516","[TCP Out-Of-Order] 51020  >  5201 [ACK] Seq=140186 Ack=1 Win=29312 Len=1374 TSval=1455333702 TSecr=1915938434"
"84334","18.917923","10.1.246.45","222.29.98.58","TCP","1516","[TCP Out-Of-Order] 51020  >  5201 [ACK] Seq=141560 Ack=1 Win=29312 Len=1374 TSval=1455333702 TSecr=1915938434"
"84335","18.917969","10.1.246.45","222.29.98.58","TCP","1516","[TCP Out-Of-Order] 51020  >  5201 [ACK] Seq=142934 Ack=1 Win=29312 Len=1374 TSval=1455333702 TSecr=1915938434"
"84336","18.918016","10.1.246.45","222.29.98.58","TCP","1516","[TCP Out-Of-Order] 51020  >  5201 [ACK] Seq=144308 Ack=1 Win=29312 Len=1374 TSval=1455333702 TSecr=1915938434"
"84337","18.918064","10.1.246.45","222.29.98.58","TCP","1516","[TCP Out-Of-Order] 51020  >  5201 [ACK] Seq=145682 Ack=1 Win=29312 Len=1374 TSval=1455333702 TSecr=1915938434"
"84338","18.918146","10.1.246.45","222.29.98.58","TCP","1516","[TCP Out-Of-Order] 51020  >  5201 [ACK] Seq=147056 Ack=1 Win=29312 Len=1374 TSval=1455333702 TSecr=1915938434"
"84339","18.918192","10.1.246.45","222.29.98.58","TCP","1516","[TCP Out-Of-Order] 51020  >  5201 [ACK] Seq=148430 Ack=1 Win=29312 Len=1374 TSval=1455333702 TSecr=1915938434"
"84340","18.918239","10.1.246.45","222.29.98.58","TCP","1516","[TCP Out-Of-Order] 51020  >  5201 [ACK] Seq=149804 Ack=1 Win=29312 Len=1374 TSval=1455333702 TSecr=1915938434"
"84341","18.918285","10.1.246.45","222.29.98.58","TCP","1516","[TCP Out-Of-Order] 51020  >  5201 [ACK] Seq=151178 Ack=1 Win=29312 Len=1374 TSval=1455333702 TSecr=1915938434"
"84342","18.918332","10.1.246.45","222.29.98.58","TCP","1516","[TCP Out-Of-Order] 51020  >  5201 [ACK] Seq=152552 Ack=1 Win=29312 Len=1374 TSval=1455333702 TSecr=1915938434"
"84343","18.918378","10.1.246.45","222.29.98.58","TCP","1516","[TCP Out-Of-Order] 51020  >  5201 [ACK] Seq=153926 Ack=1 Win=29312 Len=1374 TSval=1455333702 TSecr=1915938434"
"84344","18.918424","10.1.246.45","222.29.98.58","TCP","1516","[TCP Out-Of-Order] 51020  >  5201 [ACK] Seq=155300 Ack=1 Win=29312 Len=1374 TSval=1455333702 TSecr=1915938434"
"84358","18.919226","10.1.246.45","222.29.98.58","TCP","1516","[TCP Out-Of-Order] 51020  >  5201 [ACK] Seq=136064 Ack=1 Win=29312 Len=1374 TSval=1455333702 TSecr=1915938434"
"84359","18.919415","10.1.246.45","222.29.98.58","TCP","1516","[TCP Out-Of-Order] 51020  >  5201 [ACK] Seq=137438 Ack=1 Win=29312 Len=1374 TSval=1455333702 TSecr=1915938434"
"84360","18.919463","10.1.246.45","222.29.98.58","TCP","1516","[TCP Out-Of-Order] 51020  >  5201 [ACK] Seq=138812 Ack=1 Win=29312 Len=1374 TSval=1455333702 TSecr=1915938434"
"84361","18.919536","10.1.246.45","222.29.98.58","TCP","1516","[TCP Out-Of-Order] 51020  >  5201 [ACK] Seq=140186 Ack=1 Win=29312 Len=1374 TSval=1455333702 TSecr=1915938434"
"84362","18.919583","10.1.246.45","222.29.98.58","TCP","1516","[TCP Out-Of-Order] 51020  >  5201 [ACK] Seq=141560 Ack=1 Win=29312 Len=1374 TSval=1455333702 TSecr=1915938434"
"84363","18.919776","10.1.246.45","222.29.98.58","TCP","1516","[TCP Out-Of-Order] 51020  >  5201 [ACK] Seq=142934 Ack=1 Win=29312 Len=1374 TSval=1455333702 TSecr=1915938434"
"84364","18.919824","10.1.246.45","222.29.98.58","TCP","1516","[TCP Out-Of-Order] 51020  >  5201 [ACK] Seq=144308 Ack=1 Win=29312 Len=1374 TSval=1455333702 TSecr=1915938434"
"84365","18.919869","10.1.246.45","222.29.98.58","TCP","1516","[TCP Out-Of-Order] 51020  >  5201 [ACK] Seq=145682 Ack=1 Win=29312 Len=1374 TSval=1455333702 TSecr=1915938434"
"84366","18.919949","10.1.246.45","222.29.98.58","TCP","1516","[TCP Out-Of-Order] 51020  >  5201 [ACK] Seq=147056 Ack=1 Win=29312 Len=1374 TSval=1455333702 TSecr=1915938434"
"84367","18.919994","10.1.246.45","222.29.98.58","TCP","1516","[TCP Out-Of-Order] 51020  >  5201 [ACK] Seq=148430 Ack=1 Win=29312 Len=1374 TSval=1455333702 TSecr=1915938434"
"84368","18.920040","10.1.246.45","222.29.98.58","TCP","1516","[TCP Out-Of-Order] 51020  >  5201 [ACK] Seq=149804 Ack=1 Win=29312 Len=1374 TSval=1455333702 TSecr=1915938434"
"84369","18.920086","10.1.246.45","222.29.98.58","TCP","1516","[TCP Out-Of-Order] 51020  >  5201 [ACK] Seq=151178 Ack=1 Win=29312 Len=1374 TSval=1455333702 TSecr=1915938434"
"84370","18.920157","10.1.246.45","222.29.98.58","TCP","1516","[TCP Out-Of-Order] 51020  >  5201 [ACK] Seq=152552 Ack=1 Win=29312 Len=1374 TSval=1455333702 TSecr=1915938434"
"84371","18.920203","10.1.246.45","222.29.98.58","TCP","1516","[TCP Out-Of-Order] 51020  >  5201 [ACK] Seq=153926 Ack=1 Win=29312 Len=1374 TSval=1455333702 TSecr=1915938434"
"84372","18.920249","10.1.246.45","222.29.98.58","TCP","1516","[TCP Out-Of-Order] 51020  >  5201 [ACK] Seq=155300 Ack=1 Win=29312 Len=1374 TSval=1455333702 TSecr=1915938434"
"84394","18.922059","10.1.246.45","222.29.98.58","TCP","1516","[TCP Out-Of-Order] 51020  >  5201 [ACK] Seq=166292 Ack=1 Win=29312 Len=1374 TSval=1455333708 TSecr=1915938437"
"84395","18.922105","10.1.246.45","222.29.98.58","TCP","1508","[TCP Out-Of-Order] 51020  >  5201 [ACK] Seq=170414 Ack=1 Win=29312 Len=1374 TSval=1455333708 TSecr=1915938437"
"84407","18.923276","10.1.246.45","222.29.98.58","TCP","1516","[TCP Out-Of-Order] 51020  >  5201 [ACK] Seq=166292 Ack=1 Win=29312 Len=1374 TSval=1455333708 TSecr=1915938437"
"84408","18.923363","10.1.246.45","222.29.98.58","TCP","1508","[TCP Out-Of-Order] 51020  >  5201 [ACK] Seq=170414 Ack=1 Win=29312 Len=1374 TSval=1455333708 TSecr=1915938437"
"84445","18.926124","10.1.246.45","222.29.98.58","TCP","1516","[TCP Out-Of-Order] 51020  >  5201 [ACK] Seq=195146 Ack=1 Win=29312 Len=1374 TSval=1455333712 TSecr=1915938443"
"84446","18.926170","10.1.246.45","222.29.98.58","TCP","1508","[TCP Out-Of-Order] 51020  >  5201 [ACK] Seq=196520 Ack=1 Win=29312 Len=1374 TSval=1455333712 TSecr=1915938443"
"84461","18.927691","10.1.246.45","222.29.98.58","TCP","1516","[TCP Out-Of-Order] 51020  >  5201 [ACK] Seq=195146 Ack=1 Win=29312 Len=1374 TSval=1455333712 TSecr=1915938443"
"84462","18.927738","10.1.246.45","222.29.98.58","TCP","1516","[TCP Out-Of-Order] 51020  >  5201 [ACK] Seq=196520 Ack=1 Win=29312 Len=1374 TSval=1455333712 TSecr=1915938443"
"84463","18.927783","10.1.246.45","222.29.98.58","TCP","1516","[TCP Out-Of-Order] 51020  >  5201 [ACK] Seq=197894 Ack=1 Win=29312 Len=1374 TSval=1455333712 TSecr=1915938443"
"84464","18.927828","10.1.246.45","222.29.98.58","TCP","1516","[TCP Out-Of-Order] 51020  >  5201 [ACK] Seq=199268 Ack=1 Win=29312 Len=1374 TSval=1455333712 TSecr=1915938443"
"84465","18.927873","10.1.246.45","222.29.98.58","TCP","1516","[TCP Out-Of-Order] 51020  >  5201 [ACK] Seq=200642 Ack=1 Win=29312 Len=1374 TSval=1455333712 TSecr=1915938443"
"84466","18.927948","10.1.246.45","222.29.98.58","TCP","1516","[TCP Out-Of-Order] 51020  >  5201 [ACK] Seq=202016 Ack=1 Win=29312 Len=1374 TSval=1455333712 TSecr=1915938443"
"84467","18.927992","10.1.246.45","222.29.98.58","TCP","1516","[TCP Out-Of-Order] 51020  >  5201 [ACK] Seq=203390 Ack=1 Win=29312 Len=1374 TSval=1455333712 TSecr=1915938443"
"84468","18.928037","10.1.246.45","222.29.98.58","TCP","1516","[TCP Out-Of-Order] 51020  >  5201 [ACK] Seq=204764 Ack=1 Win=29312 Len=1374 TSval=1455333712 TSecr=1915938443"
"84469","18.928080","10.1.246.45","222.29.98.58","TCP","1516","[TCP Out-Of-Order] 51020  >  5201 [ACK] Seq=206138 Ack=1 Win=29312 Len=1374 TSval=1455333712 TSecr=1915938443"
"84470","18.928124","10.1.246.45","222.29.98.58","TCP","1516","[TCP Out-Of-Order] 51020  >  5201 [ACK] Seq=207512 Ack=1 Win=29312 Len=1374 TSval=1455333712 TSecr=1915938443"
"84522","18.933018","10.1.246.45","222.29.98.58","TCP","1516","[TCP Out-Of-Order] 51020  >  5201 [ACK] Seq=251480 Ack=1 Win=29312 Len=1374 TSval=1455333720 TSecr=1915938451"
"84523","18.933064","10.1.246.45","222.29.98.58","TCP","1516","[TCP Out-Of-Order] 51020  >  5201 [ACK] Seq=252854 Ack=1 Win=29312 Len=1374 TSval=1455333720 TSecr=1915938451"
"84524","18.933109","10.1.246.45","222.29.98.58","TCP","1516","[TCP Out-Of-Order] 51020  >  5201 [ACK] Seq=254228 Ack=1 Win=29312 Len=1374 TSval=1455333720 TSecr=1915938451"
"84525","18.933178","10.1.246.45","222.29.98.58","TCP","1516","[TCP Out-Of-Order] 51020  >  5201 [ACK] Seq=255602 Ack=1 Win=29312 Len=1374 TSval=1455333720 TSecr=1915938451"
"84526","18.933224","10.1.246.45","222.29.98.58","TCP","1516","[TCP Out-Of-Order] 51020  >  5201 [ACK] Seq=256976 Ack=1 Win=29312 Len=1374 TSval=1455333720 TSecr=1915938451"
"84527","18.933269","10.1.246.45","222.29.98.58","TCP","1516","[TCP Out-Of-Order] 51020  >  5201 [ACK] Seq=258350 Ack=1 Win=29312 Len=1374 TSval=1455333720 TSecr=1915938451"
"84533","18.935687","10.1.246.45","222.29.98.58","TCP","1516","[TCP Out-Of-Order] 51020  >  5201 [ACK] Seq=251480 Ack=1 Win=29312 Len=1374 TSval=1455333720 TSecr=1915938451"
"84534","18.935733","10.1.246.45","222.29.98.58","TCP","1516","[TCP Out-Of-Order] 51020  >  5201 [ACK] Seq=252854 Ack=1 Win=29312 Len=1374 TSval=1455333720 TSecr=1915938451"
"84535","18.935810","10.1.246.45","222.29.98.58","TCP","1516","[TCP Out-Of-Order] 51020  >  5201 [ACK] Seq=254228 Ack=1 Win=29312 Len=1374 TSval=1455333720 TSecr=1915938451"
"84536","18.935856","10.1.246.45","222.29.98.58","TCP","1516","[TCP Out-Of-Order] 51020  >  5201 [ACK] Seq=255602 Ack=1 Win=29312 Len=1374 TSval=1455333720 TSecr=1915938451"
"84537","18.935902","10.1.246.45","222.29.98.58","TCP","1516","[TCP Out-Of-Order] 51020  >  5201 [ACK] Seq=256976 Ack=1 Win=29312 Len=1374 TSval=1455333720 TSecr=1915938451"
"84538","18.935948","10.1.246.45","222.29.98.58","TCP","1516","[TCP Out-Of-Order] 51020  >  5201 [ACK] Seq=258350 Ack=1 Win=29312 Len=1374 TSval=1455333720 TSecr=1915938451"
"84670","18.946881","10.1.246.45","222.29.98.58","TCP","1516","[TCP Out-Of-Order] 51020  >  5201 [ACK] Seq=309188 Ack=1 Win=29312 Len=1374 TSval=1455333729 TSecr=1915938461"
"84671","18.946927","10.1.246.45","222.29.98.58","TCP","1516","[TCP Out-Of-Order] 51020  >  5201 [ACK] Seq=310562 Ack=1 Win=29312 Len=1374 TSval=1455333729 TSecr=1915938461"
"84672","18.946972","10.1.246.45","222.29.98.58","TCP","1516","[TCP Out-Of-Order] 51020  >  5201 [ACK] Seq=311936 Ack=1 Win=29312 Len=1374 TSval=1455333729 TSecr=1915938461"
"84673","18.947016","10.1.246.45","222.29.98.58","TCP","1516","[TCP Out-Of-Order] 51020  >  5201 [ACK] Seq=313310 Ack=1 Win=29312 Len=1374 TSval=1455333729 TSecr=1915938461"
"84674","18.947061","10.1.246.45","222.29.98.58","TCP","1516","[TCP Out-Of-Order] 51020  >  5201 [ACK] Seq=314684 Ack=1 Win=29312 Len=1374 TSval=1455333729 TSecr=1915938461"
"84675","18.947137","10.1.246.45","222.29.98.58","TCP","1516","[TCP Out-Of-Order] 51020  >  5201 [ACK] Seq=316058 Ack=1 Win=29312 Len=1374 TSval=1455333729 TSecr=1915938461"
"84676","18.947182","10.1.246.45","222.29.98.58","TCP","1516","[TCP Out-Of-Order] 51020  >  5201 [ACK] Seq=317432 Ack=1 Win=29312 Len=1374 TSval=1455333729 TSecr=1915938461"
"84777","18.957374","10.1.246.45","222.29.98.58","TCP","1516","[TCP Out-Of-Order] 51020  >  5201 [ACK] Seq=376514 Ack=1 Win=29312 Len=1374 TSval=1455333742 TSecr=1915938473"
"84778","18.957421","10.1.246.45","222.29.98.58","TCP","1516","[TCP Out-Of-Order] 51020  >  5201 [ACK] Seq=377888 Ack=1 Win=29312 Len=1374 TSval=1455333742 TSecr=1915938473"
"84779","18.957467","10.1.246.45","222.29.98.58","TCP","1516","[TCP Out-Of-Order] 51020  >  5201 [ACK] Seq=379262 Ack=1 Win=29312 Len=1374 TSval=1455333742 TSecr=1915938473"
"84780","18.957513","10.1.246.45","222.29.98.58","TCP","1516","[TCP Out-Of-Order] 51020  >  5201 [ACK] Seq=380636 Ack=1 Win=29312 Len=1374 TSval=1455333742 TSecr=1915938473"
"84781","18.957558","10.1.246.45","222.29.98.58","TCP","1516","[TCP Out-Of-Order] 51020  >  5201 [ACK] Seq=382010 Ack=1 Win=29312 Len=1374 TSval=1455333742 TSecr=1915938473"
"84782","18.957636","10.1.246.45","222.29.98.58","TCP","1516","[TCP Out-Of-Order] 51020  >  5201 [ACK] Seq=383384 Ack=1 Win=29312 Len=1374 TSval=1455333742 TSecr=1915938473"
"84783","18.957683","10.1.246.45","222.29.98.58","TCP","1516","[TCP Out-Of-Order] 51020  >  5201 [ACK] Seq=384758 Ack=1 Win=29312 Len=1374 TSval=1455333742 TSecr=1915938473"
"84784","18.957729","10.1.246.45","222.29.98.58","TCP","1516","[TCP Out-Of-Order] 51020  >  5201 [ACK] Seq=386132 Ack=1 Win=29312 Len=1374 TSval=1455333742 TSecr=1915938473"
"84785","18.957777","10.1.246.45","222.29.98.58","TCP","1516","[TCP Out-Of-Order] 51020  >  5201 [ACK] Seq=387506 Ack=1 Win=29312 Len=1374 TSval=1455333742 TSecr=1915938473"
"84786","18.957825","10.1.246.45","222.29.98.58","TCP","1516","[TCP Out-Of-Order] 51020  >  5201 [ACK] Seq=388880 Ack=1 Win=29312 Len=1374 TSval=1455333742 TSecr=1915938473"
"84787","18.957917","10.1.246.45","222.29.98.58","TCP","1516","[TCP Out-Of-Order] 51020  >  5201 [ACK] Seq=390254 Ack=1 Win=29312 Len=1374 TSval=1455333742 TSecr=1915938473"
"84788","18.957990","10.1.246.45","222.29.98.58","TCP","1516","[TCP Out-Of-Order] 51020  >  5201 [ACK] Seq=391628 Ack=1 Win=29312 Len=1374 TSval=1455333742 TSecr=1915938473"
"84806","18.960018","10.1.246.45","222.29.98.58","TCP","1516","[TCP Out-Of-Order] 51020  >  5201 [ACK] Seq=394376 Ack=1 Win=29312 Len=1374 TSval=1455333746 TSecr=1915938477"
"84807","18.960063","10.1.246.45","222.29.98.58","TCP","1516","[TCP Out-Of-Order] 51020  >  5201 [ACK] Seq=395750 Ack=1 Win=29312 Len=1374 TSval=1455333746 TSecr=1915938477"
"84808","18.960107","10.1.246.45","222.29.98.58","TCP","1516","[TCP Out-Of-Order] 51020  >  5201 [ACK] Seq=397124 Ack=1 Win=29312 Len=1374 TSval=1455333746 TSecr=1915938477"
"84809","18.960151","10.1.246.45","222.29.98.58","TCP","1516","[TCP Out-Of-Order] 51020  >  5201 [ACK] Seq=398498 Ack=1 Win=29312 Len=1374 TSval=1455333746 TSecr=1915938477"
"84810","18.960216","10.1.246.45","222.29.98.58","TCP","1516","[TCP Out-Of-Order] 51020  >  5201 [ACK] Seq=399872 Ack=1 Win=29312 Len=1374 TSval=1455333746 TSecr=1915938477"
"84811","18.960260","10.1.246.45","222.29.98.58","TCP","1516","[TCP Out-Of-Order] 51020  >  5201 [ACK] Seq=401246 Ack=1 Win=29312 Len=1374 TSval=1455333746 TSecr=1915938477"
"84812","18.960303","10.1.246.45","222.29.98.58","TCP","1508","[TCP Out-Of-Order] 51020  >  5201 [ACK] Seq=402620 Ack=1 Win=29312 Len=1374 TSval=1455333746 TSecr=1915938477"
"84820","18.961114","10.1.246.45","222.29.98.58","TCP","1516","[TCP Out-Of-Order] 51020  >  5201 [ACK] Seq=397124 Ack=1 Win=29312 Len=1374 TSval=1455333746 TSecr=1915938477"
"84821","18.961159","10.1.246.45","222.29.98.58","TCP","1516","[TCP Out-Of-Order] 51020  >  5201 [ACK] Seq=398498 Ack=1 Win=29312 Len=1374 TSval=1455333746 TSecr=1915938477"
"84822","18.961247","10.1.246.45","222.29.98.58","TCP","1516","[TCP Out-Of-Order] 51020  >  5201 [ACK] Seq=401246 Ack=1 Win=29312 Len=1374 TSval=1455333746 TSecr=1915938477"
"84823","18.961294","10.1.246.45","222.29.98.58","TCP","1516","[TCP Out-Of-Order] 51020  >  5201 [ACK] Seq=402620 Ack=1 Win=29312 Len=1374 TSval=1455333746 TSecr=1915938477"
"84824","18.961340","10.1.246.45","222.29.98.58","TCP","1516","[TCP Out-Of-Order] 51020  >  5201 [ACK] Seq=403994 Ack=1 Win=29312 Len=1374 TSval=1455333746 TSecr=1915938477"
"84825","18.961385","10.1.246.45","222.29.98.58","TCP","1516","[TCP Out-Of-Order] 51020  >  5201 [ACK] Seq=406742 Ack=1 Win=29312 Len=1374 TSval=1455333746 TSecr=1915938477"
"84826","18.961430","10.1.246.45","222.29.98.58","TCP","1508","[TCP Out-Of-Order] 51020  >  5201 [ACK] Seq=413612 Ack=1 Win=29312 Len=1374 TSval=1455333746 TSecr=1915938477"
"84833","18.962384","10.1.246.45","222.29.98.58","TCP","1516","[TCP Out-Of-Order] 51020  >  5201 [ACK] Seq=397124 Ack=1 Win=29312 Len=1374 TSval=1455333746 TSecr=1915938477"
"84834","18.962430","10.1.246.45","222.29.98.58","TCP","1516","[TCP Out-Of-Order] 51020  >  5201 [ACK] Seq=398498 Ack=1 Win=29312 Len=1374 TSval=1455333746 TSecr=1915938477"
"84835","18.962473","10.1.246.45","222.29.98.58","TCP","1516","[TCP Out-Of-Order] 51020  >  5201 [ACK] Seq=401246 Ack=1 Win=29312 Len=1374 TSval=1455333746 TSecr=1915938477"
"84836","18.962518","10.1.246.45","222.29.98.58","TCP","1516","[TCP Out-Of-Order] 51020  >  5201 [ACK] Seq=402620 Ack=1 Win=29312 Len=1374 TSval=1455333746 TSecr=1915938477"
"84837","18.962563","10.1.246.45","222.29.98.58","TCP","1516","[TCP Out-Of-Order] 51020  >  5201 [ACK] Seq=403994 Ack=1 Win=29312 Len=1374 TSval=1455333746 TSecr=1915938477"
"84838","18.962607","10.1.246.45","222.29.98.58","TCP","1516","[TCP Out-Of-Order] 51020  >  5201 [ACK] Seq=406742 Ack=1 Win=29312 Len=1374 TSval=1455333746 TSecr=1915938477"
"84839","18.962653","10.1.246.45","222.29.98.58","TCP","1508","[TCP Out-Of-Order] 51020  >  5201 [ACK] Seq=413612 Ack=1 Win=29312 Len=1374 TSval=1455333746 TSecr=1915938477"
"84847","18.963347","10.1.246.45","222.29.98.58","TCP","1516","[TCP Out-Of-Order] 51020  >  5201 [ACK] Seq=397124 Ack=1 Win=29312 Len=1374 TSval=1455333746 TSecr=1915938477"
"84848","18.963394","10.1.246.45","222.29.98.58","TCP","1516","[TCP Out-Of-Order] 51020  >  5201 [ACK] Seq=398498 Ack=1 Win=29312 Len=1374 TSval=1455333746 TSecr=1915938477"
"84849","18.963441","10.1.246.45","222.29.98.58","TCP","1516","[TCP Out-Of-Order] 51020  >  5201 [ACK] Seq=401246 Ack=1 Win=29312 Len=1374 TSval=1455333746 TSecr=1915938477"
"84850","18.963518","10.1.246.45","222.29.98.58","TCP","1516","[TCP Out-Of-Order] 51020  >  5201 [ACK] Seq=402620 Ack=1 Win=29312 Len=1374 TSval=1455333746 TSecr=1915938477"
"84851","18.963563","10.1.246.45","222.29.98.58","TCP","1516","[TCP Out-Of-Order] 51020  >  5201 [ACK] Seq=403994 Ack=1 Win=29312 Len=1374 TSval=1455333746 TSecr=1915938477"
"84852","18.963608","10.1.246.45","222.29.98.58","TCP","1516","[TCP Out-Of-Order] 51020  >  5201 [ACK] Seq=406742 Ack=1 Win=29312 Len=1374 TSval=1455333746 TSecr=1915938477"
"84853","18.963654","10.1.246.45","222.29.98.58","TCP","1508","[TCP Out-Of-Order] 51020  >  5201 [ACK] Seq=413612 Ack=1 Win=29312 Len=1374 TSval=1455333746 TSecr=1915938477"
"84857","18.964249","10.1.246.45","222.29.98.58","TCP","1516","[TCP Out-Of-Order] 51020  >  5201 [ACK] Seq=397124 Ack=1 Win=29312 Len=1374 TSval=1455333746 TSecr=1915938477"
"84858","18.964296","10.1.246.45","222.29.98.58","TCP","1516","[TCP Out-Of-Order] 51020  >  5201 [ACK] Seq=398498 Ack=1 Win=29312 Len=1374 TSval=1455333746 TSecr=1915938477"
"84859","18.964341","10.1.246.45","222.29.98.58","TCP","1516","[TCP Out-Of-Order] 51020  >  5201 [ACK] Seq=401246 Ack=1 Win=29312 Len=1374 TSval=1455333746 TSecr=1915938477"
"84860","18.964416","10.1.246.45","222.29.98.58","TCP","1516","[TCP Out-Of-Order] 51020  >  5201 [ACK] Seq=402620 Ack=1 Win=29312 Len=1374 TSval=1455333746 TSecr=1915938477"
"84861","18.964461","10.1.246.45","222.29.98.58","TCP","1516","[TCP Out-Of-Order] 51020  >  5201 [ACK] Seq=403994 Ack=1 Win=29312 Len=1374 TSval=1455333746 TSecr=1915938477"
"84862","18.964506","10.1.246.45","222.29.98.58","TCP","1516","[TCP Out-Of-Order] 51020  >  5201 [ACK] Seq=406742 Ack=1 Win=29312 Len=1374 TSval=1455333746 TSecr=1915938477"
"84863","18.964550","10.1.246.45","222.29.98.58","TCP","1508","[TCP Out-Of-Order] 51020  >  5201 [ACK] Seq=413612 Ack=1 Win=29312 Len=1374 TSval=1455333746 TSecr=1915938477"
"85322","19.024447","10.1.246.45","222.29.98.58","TCP","1516","[TCP Out-Of-Order] 51020  >  5201 [ACK] Seq=458954 Ack=1 Win=29312 Len=1374 TSval=1455333810 TSecr=1915938540"
"85323","19.024491","10.1.246.45","222.29.98.58","TCP","1516","[TCP Out-Of-Order] 51020  >  5201 [ACK] Seq=460328 Ack=1 Win=29312 Len=1374 TSval=1455333810 TSecr=1915938540"
"85324","19.024536","10.1.246.45","222.29.98.58","TCP","1516","[TCP Out-Of-Order] 51020  >  5201 [ACK] Seq=461702 Ack=1 Win=29312 Len=1374 TSval=1455333810 TSecr=1915938540"
"85325","19.024583","10.1.246.45","222.29.98.58","TCP","1508","[TCP Out-Of-Order] 51020  >  5201 [ACK] Seq=463076 Ack=1 Win=29312 Len=1374 TSval=1455333810 TSecr=1915938540"
"85341","19.025347","10.1.246.45","222.29.98.58","TCP","1516","[TCP Out-Of-Order] 51020  >  5201 [ACK] Seq=469946 Ack=1 Win=29312 Len=1374 TSval=1455333812 TSecr=1915938543"
"85342","19.025393","10.1.246.45","222.29.98.58","TCP","1516","[TCP Out-Of-Order] 51020  >  5201 [ACK] Seq=472694 Ack=1 Win=29312 Len=1374 TSval=1455333812 TSecr=1915938543"
"85343","19.025438","10.1.246.45","222.29.98.58","TCP","1516","[TCP Out-Of-Order] 51020  >  5201 [ACK] Seq=474068 Ack=1 Win=29312 Len=1374 TSval=1455333812 TSecr=1915938543"
"85344","19.025482","10.1.246.45","222.29.98.58","TCP","1516","[TCP Out-Of-Order] 51020  >  5201 [ACK] Seq=475442 Ack=1 Win=29312 Len=1374 TSval=1455333812 TSecr=1915938543"
"85345","19.025526","10.1.246.45","222.29.98.58","TCP","1516","[TCP Out-Of-Order] 51020  >  5201 [ACK] Seq=476816 Ack=1 Win=29312 Len=1374 TSval=1455333812 TSecr=1915938543"
"85346","19.025570","10.1.246.45","222.29.98.58","TCP","1516","[TCP Out-Of-Order] 51020  >  5201 [ACK] Seq=478190 Ack=1 Win=29312 Len=1374 TSval=1455333812 TSecr=1915938543"
"85347","19.025640","10.1.246.45","222.29.98.58","TCP","1516","[TCP Out-Of-Order] 51020  >  5201 [ACK] Seq=479564 Ack=1 Win=29312 Len=1374 TSval=1455333812 TSecr=1915938543"
"85348","19.025684","10.1.246.45","222.29.98.58","TCP","1516","[TCP Out-Of-Order] 51020  >  5201 [ACK] Seq=480938 Ack=1 Win=29312 Len=1374 TSval=1455333812 TSecr=1915938543"
"85367","19.027975","10.1.246.45","222.29.98.58","TCP","1516","[TCP Out-Of-Order] 51020  >  5201 [ACK] Seq=469946 Ack=1 Win=29312 Len=1374 TSval=1455333812 TSecr=1915938543"
"85368","19.028022","10.1.246.45","222.29.98.58","TCP","1516","[TCP Out-Of-Order] 51020  >  5201 [ACK] Seq=472694 Ack=1 Win=29312 Len=1374 TSval=1455333812 TSecr=1915938543"
"85369","19.028067","10.1.246.45","222.29.98.58","TCP","1516","[TCP Out-Of-Order] 51020  >  5201 [ACK] Seq=474068 Ack=1 Win=29312 Len=1374 TSval=1455333812 TSecr=1915938543"
"85370","19.028111","10.1.246.45","222.29.98.58","TCP","1516","[TCP Out-Of-Order] 51020  >  5201 [ACK] Seq=475442 Ack=1 Win=29312 Len=1374 TSval=1455333812 TSecr=1915938543"
"85371","19.028155","10.1.246.45","222.29.98.58","TCP","1516","[TCP Out-Of-Order] 51020  >  5201 [ACK] Seq=476816 Ack=1 Win=29312 Len=1374 TSval=1455333812 TSecr=1915938543"
"85372","19.028200","10.1.246.45","222.29.98.58","TCP","1516","[TCP Out-Of-Order] 51020  >  5201 [ACK] Seq=478190 Ack=1 Win=29312 Len=1374 TSval=1455333812 TSecr=1915938543"
"85373","19.028244","10.1.246.45","222.29.98.58","TCP","1516","[TCP Out-Of-Order] 51020  >  5201 [ACK] Seq=479564 Ack=1 Win=29312 Len=1374 TSval=1455333812 TSecr=1915938543"
"85374","19.028289","10.1.246.45","222.29.98.58","TCP","1516","[TCP Out-Of-Order] 51020  >  5201 [ACK] Seq=480938 Ack=1 Win=29312 Len=1374 TSval=1455333812 TSecr=1915938543"
"85393","19.029255","10.1.246.45","222.29.98.58","TCP","1516","[TCP Out-Of-Order] 51020  >  5201 [ACK] Seq=485060 Ack=1 Win=29312 Len=1374 TSval=1455333816 TSecr=1915938543"
"85394","19.029299","10.1.246.45","222.29.98.58","TCP","1516","[TCP Out-Of-Order] 51020  >  5201 [ACK] Seq=486434 Ack=1 Win=29312 Len=1374 TSval=1455333816 TSecr=1915938543"
"85395","19.029365","10.1.246.45","222.29.98.58","TCP","1516","[TCP Out-Of-Order] 51020  >  5201 [ACK] Seq=487808 Ack=1 Win=29312 Len=1374 TSval=1455333816 TSecr=1915938543"
"85396","19.029410","10.1.246.45","222.29.98.58","TCP","1516","[TCP Out-Of-Order] 51020  >  5201 [ACK] Seq=489182 Ack=1 Win=29312 Len=1374 TSval=1455333816 TSecr=1915938543"
"85397","19.029476","10.1.246.45","222.29.98.58","TCP","1516","[TCP Out-Of-Order] 51020  >  5201 [ACK] Seq=490556 Ack=1 Win=29312 Len=1374 TSval=1455333816 TSecr=1915938543"
"85398","19.029521","10.1.246.45","222.29.98.58","TCP","1516","[TCP Out-Of-Order] 51020  >  5201 [ACK] Seq=491930 Ack=1 Win=29312 Len=1374 TSval=1455333816 TSecr=1915938543"
"85399","19.029637","10.1.246.45","222.29.98.58","TCP","1516","[TCP Out-Of-Order] 51020  >  5201 [ACK] Seq=493304 Ack=1 Win=29312 Len=1374 TSval=1455333816 TSecr=1915938543"
"85400","19.029682","10.1.246.45","222.29.98.58","TCP","1516","[TCP Out-Of-Order] 51020  >  5201 [ACK] Seq=496052 Ack=1 Win=29312 Len=1374 TSval=1455333816 TSecr=1915938543"
"85437","19.033242","10.1.246.45","222.29.98.58","TCP","1516","[TCP Out-Of-Order] 51020  >  5201 [ACK] Seq=498800 Ack=1 Win=29312 Len=1374 TSval=1455333816 TSecr=1915938543"
"85438","19.033287","10.1.246.45","222.29.98.58","TCP","1516","[TCP Out-Of-Order] 51020  >  5201 [ACK] Seq=500174 Ack=1 Win=29312 Len=1374 TSval=1455333818 TSecr=1915938546"
"85439","19.033354","10.1.246.45","222.29.98.58","TCP","1516","[TCP Out-Of-Order] 51020  >  5201 [ACK] Seq=501548 Ack=1 Win=29312 Len=1374 TSval=1455333818 TSecr=1915938546"
"85440","19.033398","10.1.246.45","222.29.98.58","TCP","1516","[TCP Out-Of-Order] 51020  >  5201 [ACK] Seq=502922 Ack=1 Win=29312 Len=1374 TSval=1455333818 TSecr=1915938546"
"85441","19.033466","10.1.246.45","222.29.98.58","TCP","1516","[TCP Out-Of-Order] 51020  >  5201 [ACK] Seq=504296 Ack=1 Win=29312 Len=1374 TSval=1455333818 TSecr=1915938546"
"85442","19.033509","10.1.246.45","222.29.98.58","TCP","1516","[TCP Out-Of-Order] 51020  >  5201 [ACK] Seq=505670 Ack=1 Win=29312 Len=1374 TSval=1455333818 TSecr=1915938546"
"85443","19.033554","10.1.246.45","222.29.98.58","TCP","1516","[TCP Out-Of-Order] 51020  >  5201 [ACK] Seq=507044 Ack=1 Win=29312 Len=1374 TSval=1455333818 TSecr=1915938546"
"85444","19.033622","10.1.246.45","222.29.98.58","TCP","1516","[TCP Out-Of-Order] 51020  >  5201 [ACK] Seq=508418 Ack=1 Win=29312 Len=1374 TSval=1455333818 TSecr=1915938546"
"85445","19.033667","10.1.246.45","222.29.98.58","TCP","1516","[TCP Out-Of-Order] 51020  >  5201 [ACK] Seq=509792 Ack=1 Win=29312 Len=1374 TSval=1455333818 TSecr=1915938546"
"85446","19.033712","10.1.246.45","222.29.98.58","TCP","1516","[TCP Out-Of-Order] 51020  >  5201 [ACK] Seq=511166 Ack=1 Win=29312 Len=1374 TSval=1455333818 TSecr=1915938546"
"85447","19.033783","10.1.246.45","222.29.98.58","TCP","1516","[TCP Out-Of-Order] 51020  >  5201 [ACK] Seq=512540 Ack=1 Win=29312 Len=1374 TSval=1455333818 TSecr=1915938546"
"85462","19.035500","10.1.246.45","222.29.98.58","TCP","1516","[TCP Out-Of-Order] 51020  >  5201 [ACK] Seq=516662 Ack=1 Win=29312 Len=1374 TSval=1455333822 TSecr=1915938552"
"85463","19.035546","10.1.246.45","222.29.98.58","TCP","1516","[TCP Out-Of-Order] 51020  >  5201 [ACK] Seq=518036 Ack=1 Win=29312 Len=1374 TSval=1455333822 TSecr=1915938552"
"85464","19.035590","10.1.246.45","222.29.98.58","TCP","1516","[TCP Out-Of-Order] 51020  >  5201 [ACK] Seq=519410 Ack=1 Win=29312 Len=1374 TSval=1455333822 TSecr=1915938552"
"85465","19.035664","10.1.246.45","222.29.98.58","TCP","1516","[TCP Out-Of-Order] 51020  >  5201 [ACK] Seq=520784 Ack=1 Win=29312 Len=1374 TSval=1455333822 TSecr=1915938552"
"85466","19.035708","10.1.246.45","222.29.98.58","TCP","1516","[TCP Out-Of-Order] 51020  >  5201 [ACK] Seq=522158 Ack=1 Win=29312 Len=1374 TSval=1455333822 TSecr=1915938552"
"85467","19.035753","10.1.246.45","222.29.98.58","TCP","1516","[TCP Out-Of-Order] 51020  >  5201 [ACK] Seq=523532 Ack=1 Win=29312 Len=1374 TSval=1455333822 TSecr=1915938552"
"85468","19.035796","10.1.246.45","222.29.98.58","TCP","1516","[TCP Out-Of-Order] 51020  >  5201 [ACK] Seq=524906 Ack=1 Win=29312 Len=1374 TSval=1455333822 TSecr=1915938552"
"85469","19.035841","10.1.246.45","222.29.98.58","TCP","1516","[TCP Out-Of-Order] 51020  >  5201 [ACK] Seq=526280 Ack=1 Win=29312 Len=1374 TSval=1455333822 TSecr=1915938552"
"85470","19.035886","10.1.246.45","222.29.98.58","TCP","1508","[TCP Out-Of-Order] 51020  >  5201 [ACK] Seq=527654 Ack=1 Win=29312 Len=1374 TSval=1455333822 TSecr=1915938552"
"85479","19.037008","10.1.246.45","222.29.98.58","TCP","1516","[TCP Out-Of-Order] 51020  >  5201 [ACK] Seq=516662 Ack=1 Win=29312 Len=1374 TSval=1455333822 TSecr=1915938552"
"85480","19.037053","10.1.246.45","222.29.98.58","TCP","1516","[TCP Out-Of-Order] 51020  >  5201 [ACK] Seq=518036 Ack=1 Win=29312 Len=1374 TSval=1455333822 TSecr=1915938552"
"85481","19.037098","10.1.246.45","222.29.98.58","TCP","1516","[TCP Out-Of-Order] 51020  >  5201 [ACK] Seq=519410 Ack=1 Win=29312 Len=1374 TSval=1455333822 TSecr=1915938552"
"85482","19.037143","10.1.246.45","222.29.98.58","TCP","1516","[TCP Out-Of-Order] 51020  >  5201 [ACK] Seq=520784 Ack=1 Win=29312 Len=1374 TSval=1455333822 TSecr=1915938552"
"85483","19.037187","10.1.246.45","222.29.98.58","TCP","1516","[TCP Out-Of-Order] 51020  >  5201 [ACK] Seq=522158 Ack=1 Win=29312 Len=1374 TSval=1455333822 TSecr=1915938552"
"85484","19.037231","10.1.246.45","222.29.98.58","TCP","1516","[TCP Out-Of-Order] 51020  >  5201 [ACK] Seq=523532 Ack=1 Win=29312 Len=1374 TSval=1455333822 TSecr=1915938552"
"85485","19.037304","10.1.246.45","222.29.98.58","TCP","1516","[TCP Out-Of-Order] 51020  >  5201 [ACK] Seq=524906 Ack=1 Win=29312 Len=1374 TSval=1455333822 TSecr=1915938552"
"85486","19.037349","10.1.246.45","222.29.98.58","TCP","1516","[TCP Out-Of-Order] 51020  >  5201 [ACK] Seq=526280 Ack=1 Win=29312 Len=1374 TSval=1455333822 TSecr=1915938552"
"85487","19.037392","10.1.246.45","222.29.98.58","TCP","1516","[TCP Out-Of-Order] 51020  >  5201 [ACK] Seq=527654 Ack=1 Win=29312 Len=1374 TSval=1455333822 TSecr=1915938552"
"85488","19.037439","10.1.246.45","222.29.98.58","TCP","1516","[TCP Out-Of-Order] 51020  >  5201 [ACK] Seq=529028 Ack=1 Win=29312 Len=1374 TSval=1455333822 TSecr=1915938552"
"85489","19.037483","10.1.246.45","222.29.98.58","TCP","1516","[TCP Out-Of-Order] 51020  >  5201 [ACK] Seq=530402 Ack=1 Win=29312 Len=1374 TSval=1455333822 TSecr=1915938552"
"85491","19.037599","10.1.246.45","222.29.98.58","TCP","1508","[TCP Out-Of-Order] 51020  >  5201 [ACK] Seq=516662 Ack=1 Win=29312 Len=1374 TSval=1455333822 TSecr=1915938552"
"85493","19.038038","10.1.246.45","222.29.98.58","TCP","1516","[TCP Out-Of-Order] 51020  >  5201 [ACK] Seq=518036 Ack=1 Win=29312 Len=1374 TSval=1455333822 TSecr=1915938552"
"85494","19.038085","10.1.246.45","222.29.98.58","TCP","1516","[TCP Out-Of-Order] 51020  >  5201 [ACK] Seq=519410 Ack=1 Win=29312 Len=1374 TSval=1455333822 TSecr=1915938552"
"85495","19.038130","10.1.246.45","222.29.98.58","TCP","1516","[TCP Out-Of-Order] 51020  >  5201 [ACK] Seq=520784 Ack=1 Win=29312 Len=1374 TSval=1455333822 TSecr=1915938552"
"85496","19.038174","10.1.246.45","222.29.98.58","TCP","1516","[TCP Out-Of-Order] 51020  >  5201 [ACK] Seq=522158 Ack=1 Win=29312 Len=1374 TSval=1455333822 TSecr=1915938552"
